build time -- 2021-10-01 06:18:04
Beginning Test, file ESMC_ArrayUTest.C, line 46
NUMBER_OF_PROCESSORS 4
PASS ArraySpecSet, ESMC_ArrayUTest.C, line 55
PASS Set up minIndex, ESMC_ArrayUTest.C, line 65
PASS Set up maxIndex, ESMC_ArrayUTest.C, line 76
PASS Create 5 x 10 ESMC_DistGrid object, ESMC_ArrayUTest.C, line 84
Beginning Test, file ESMC_ArrayUTest.C, line 46
NUMBER_OF_PROCESSORS 4
PASS ArraySpecSet, ESMC_ArrayUTest.C, line 55
PASS Set up minIndex, ESMC_ArrayUTest.C, line 65
PASS Set up maxIndex, ESMC_ArrayUTest.C, line 76
PASS Create 5 x 10 ESMC_DistGrid object, ESMC_ArrayUTest.C, line 84
Beginning Test, file ESMC_ArrayUTest.C, line 46
NUMBER_OF_PROCESSORS 4
PASS ArraySpecSet, ESMC_ArrayUTest.C, line 55
PASS Set up minIndex, ESMC_ArrayUTest.C, line 65
PASS Set up maxIndex, ESMC_ArrayUTest.C, line 76
PASS Create ESMC_Array object, ESMC_ArrayUTest.C, line 96
--- ESMCI::Array::print start ---
 Base name    = array1
 Status: Base = Ready,  object = Ready
 Proxy        = no
 Root Info (Attributes):
PASS Create 5 x 10 ESMC_DistGrid object, ESMC_ArrayUTest.C, line 84
{}Array typekind/rank: Integer*4 / 2 
~ lower class' values ~
DistGrid dimCount = 2
deCount = 4
localDeCount = 1
~ local data in LocalArray for DE 0 ~
LocalArrayPrint: Array at address 0x22942a0:
            rank = 2, typekind = 3, base_addr = 0x7f9f92adbfa0
            dim[0] = 2  dim[1] = 10  
  Integer, *4, Dim 2, Data values:
( 1, 1) =  1397965136
( 2, 1) =  1701987104
( 1, 2) =  543519841
PASS Create ESMC_Array object, ESMC_ArrayUTest.C, line 96
( 2, 2) =  544743477
( 1, 3) =  1159737393
( 2, 3) =  1598246227
( 1, 4) =  1953720644
( 2, 4) =  1684632135
( 1, 5) =  1784835872
( 2, 5) =  745825125
( 1, 6) =  1297302816
( 2, 6) =  1916886851
( 1, 7) =  1434018162
( 2, 7) =  1953719636
--- ESMCI::Array::print start ---
( 1, 8) =  539771694
( 2, 8) =  1701734764
( 1, 9) =  1681143840
( 2, 9) =  0
( 1,10) =  0
( 2,10) =  0
dim 1: [0]: [1 [1 [1, 2] 2] 2]
dim 2: [1]: [1 [1 [1, 10] 10] 10]
--- ESMCI::Array::print end ---
 Base name    = array1
 Status: Base = Ready,  object = Ready
 Proxy        = no
PASS Print ESMC_Array object, ESMC_ArrayUTest.C, line 104
 Root Info (Attributes):
Beginning Test, file ESMC_ArrayUTest.C, line 46
PASS Destroy ESMC_DistGrid object, ESMC_ArrayUTest.C, line 112
NUMBER_OF_PROCESSORS 4
PASS ArraySpecSet, ESMC_ArrayUTest.C, line 55
PASS Destroy ESMC_Array object, ESMC_ArrayUTest.C, line 120
PASS Set up minIndex, ESMC_ArrayUTest.C, line 65
Ending Test, file ESMC_ArrayUTest.C, line 124
PASS Set up maxIndex, ESMC_ArrayUTest.C, line 76
{}Array typekind/rank: Integer*4 / 2 
~ lower class' values ~
DistGrid dimCount = 2
deCount = 4
localDeCount = 1
~ local data in LocalArray for DE 3 ~
LocalArrayPrint: Array at address 0x1f31790:
            rank = 2, typekind = 3, base_addr = 0x7fb74632bd40
            dim[0] = 1  dim[1] = 10  
  Integer, *4, Dim 2, Data values:
( 1, 1) =  1177730304
( 1, 2) =  32695
( 1, 3) =  544240928
( 1, 4) =  1232626029
( 1, 5) =  2019910766
( 1, 6) =  1397039148
( 1, 7) =  1096762189
( 1, 8) =  2036429426
( 1, 9) =  1936020565
( 1,10) =  742600308
dim 1: [0]: [1 [1 [1, 1] 1] 1]
dim 2: [1]: [1 [1 [1, 10] 10] 10]
--- ESMCI::Array::print end ---
PASS Print ESMC_Array object, ESMC_ArrayUTest.C, line 104
PASS Destroy ESMC_DistGrid object, ESMC_ArrayUTest.C, line 112
PASS Create ESMC_Array object, ESMC_ArrayUTest.C, line 96
--- ESMCI::Array::print start ---
PASS Destroy ESMC_Array object, ESMC_ArrayUTest.C, line 120
 Base name    = array1
Ending Test, file ESMC_ArrayUTest.C, line 124
 Status: Base = Ready,  object = Ready
 Proxy        = no
 Root Info (Attributes):
PASS Create 5 x 10 ESMC_DistGrid object, ESMC_ArrayUTest.C, line 84
{}Array typekind/rank: Integer*4 / 2 
~ lower class' values ~
DistGrid dimCount = 2
deCount = 4
localDeCount = 1
~ local data in LocalArray for DE 2 ~
LocalArrayPrint: Array at address 0x1935790:
            rank = 2, typekind = 3, base_addr = 0x7f535c507d40
            dim[0] = 1  dim[1] = 10  
  Integer, *4, Dim 2, Data values:
( 1, 1) =  1548778752
( 1, 2) =  32595
( 1, 3) =  544240928
( 1, 4) =  1232626029
( 1, 5) =  2019910766
( 1, 6) =  1397039148
( 1, 7) =  1096762189
( 1, 8) =  2036429426
( 1, 9) =  1936020565
( 1,10) =  742600308
dim 1: [0]: [1 [1 [1, 1] 1] 1]
dim 2: [1]: [1 [1 [1, 10] 10] 10]
--- ESMCI::Array::print end ---
PASS Print ESMC_Array object, ESMC_ArrayUTest.C, line 104
PASS Destroy ESMC_DistGrid object, ESMC_ArrayUTest.C, line 112
PASS Destroy ESMC_Array object, ESMC_ArrayUTest.C, line 120
Ending Test, file ESMC_ArrayUTest.C, line 124
PASS Create ESMC_Array object, ESMC_ArrayUTest.C, line 96
--- ESMCI::Array::print start ---
 Base name    = array1
 Status: Base = Ready,  object = Ready
 Proxy        = no
 Root Info (Attributes):
{}Array typekind/rank: Integer*4 / 2 
~ lower class' values ~
DistGrid dimCount = 2
deCount = 4
localDeCount = 1
~ local data in LocalArray for DE 1 ~
LocalArrayPrint: Array at address 0xff7790:
            rank = 2, typekind = 3, base_addr = 0x7fc9a75ffd40
            dim[0] = 1  dim[1] = 10  
  Integer, *4, Dim 2, Data values:
( 1, 1) =  -1486881536
( 1, 2) =  32713
( 1, 3) =  544240928
( 1, 4) =  1232626029
( 1, 5) =  2019910766
( 1, 6) =  1397039148
( 1, 7) =  1096762189
( 1, 8) =  2036429426
( 1, 9) =  1936020565
( 1,10) =  742600308
dim 1: [0]: [1 [1 [1, 1] 1] 1]
dim 2: [1]: [1 [1 [1, 10] 10] 10]
--- ESMCI::Array::print end ---
PASS Print ESMC_Array object, ESMC_ArrayUTest.C, line 104
PASS Destroy ESMC_DistGrid object, ESMC_ArrayUTest.C, line 112
PASS Destroy ESMC_Array object, ESMC_ArrayUTest.C, line 120
Ending Test, file ESMC_ArrayUTest.C, line 124
 PET 1 Test Elapsed Time  5.763000 msec.
 PET 0 Test Elapsed Time  8.791000 msec.
 PET 3 Test Elapsed Time  7.929000 msec.
 PET 2 Test Elapsed Time  7.174000 msec.
TOTCPU=07:52:00 ELAP=00:14:45 REQMEM=5875Mc REQCPUS=24 ALLOCCPUS=32 TIMELIMIT=02:30:00 PART=s4 ACCT=star
MAXRSS=0 MAXVMSIZE=196896K
________________________________________________________________
Job Resource Usage Summary for 11448910

  CPU Time Used : 07:52:00
  Memory Used : 0
  Virtual Memory Used : 196896K
  Walltime Used : 00:14:45

  Memory Requested : 5875Mc (n=per node; c=per core)
  CPUs Requested / Allocated : 24 / 32
  Walltime Requested : 02:30:00

  Execution Queue : s4
  Head Node : 
  Charged to : star

  Job Stopped : Fri Oct  1 06:32:50 UTC 2021
_____________________________________________________________________

