build time -- 2021-10-04 06:19:50
Beginning Test, file ESMC_ArrayUTest.C, line 46
NUMBER_OF_PROCESSORS 4
PASS ArraySpecSet, ESMC_ArrayUTest.C, line 55
PASS Set up minIndex, ESMC_ArrayUTest.C, line 65
PASS Set up maxIndex, ESMC_ArrayUTest.C, line 76
PASS Create 5 x 10 ESMC_DistGrid object, ESMC_ArrayUTest.C, line 84
PASS Create ESMC_Array object, ESMC_ArrayUTest.C, line 96
--- ESMCI::Array::print start ---
 Base name    = array1
 Status: Base = Ready,  object = Ready
 Proxy        = no
 Root Info (Attributes):
{}Array typekind/rank: Integer*4 / 2 
~ lower class' values ~
DistGrid dimCount = 2
deCount = 4
localDeCount = 1
~ local data in LocalArray for DE 0 ~
LocalArrayPrint: Array at address 0x165f280:
            rank = 2, typekind = 3, base_addr = 0x7f98ab33bfa0
            dim[0] = 2  dim[1] = 10  
  Integer, *4, Dim 2, Data values:
( 1, 1) =  1397965136
( 2, 1) =  1701987104
( 1, 2) =  543519841
( 2, 2) =  544743477
( 1, 3) =  1159737393
( 2, 3) =  1598246227
( 1, 4) =  1953720644
( 2, 4) =  1684632135
( 1, 5) =  1784835872
( 2, 5) =  745825125
( 1, 6) =  1297302816
( 2, 6) =  1916886851
( 1, 7) =  1434018162
( 2, 7) =  1953719636
( 1, 8) =  539771694
( 2, 8) =  1701734764
( 1, 9) =  825505824
( 2, 9) =  55
( 1,10) =  0
( 2,10) =  0
dim 1: [0]: [1 [1 [1, 2] 2] 2]
dim 2: [1]: [1 [1 [1, 10] 10] 10]
--- ESMCI::Array::print end ---
PASS Print ESMC_Array object, ESMC_ArrayUTest.C, line 104
PASS Destroy ESMC_DistGrid object, ESMC_ArrayUTest.C, line 112
PASS Destroy ESMC_Array object, ESMC_ArrayUTest.C, line 120
Ending Test, file ESMC_ArrayUTest.C, line 124
Beginning Test, file ESMC_ArrayUTest.C, line 46
NUMBER_OF_PROCESSORS 4
PASS ArraySpecSet, ESMC_ArrayUTest.C, line 55
PASS Set up minIndex, ESMC_ArrayUTest.C, line 65
PASS Set up maxIndex, ESMC_ArrayUTest.C, line 76
PASS Create 5 x 10 ESMC_DistGrid object, ESMC_ArrayUTest.C, line 84
PASS Create ESMC_Array object, ESMC_ArrayUTest.C, line 96
--- ESMCI::Array::print start ---
 Base name    = array1
 Status: Base = Ready,  object = Ready
 Proxy        = no
 Root Info (Attributes):
{}Array typekind/rank: Integer*4 / 2 
~ lower class' values ~
DistGrid dimCount = 2
deCount = 4
localDeCount = 1
~ local data in LocalArray for DE 2 ~
LocalArrayPrint: Array at address 0x24bd7d0:
            rank = 2, typekind = 3, base_addr = 0x7f8461183d40
            dim[0] = 1  dim[1] = 10  
  Integer, *4, Dim 2, Data values:
( 1, 1) =  1628978432
( 1, 2) =  32644
( 1, 3) =  544240928
( 1, 4) =  1232626029
( 1, 5) =  2019910766
( 1, 6) =  1397039148
( 1, 7) =  1096762189
( 1, 8) =  2036429426
( 1, 9) =  1936020565
( 1,10) =  742600308
dim 1: [0]: [1 [1 [1, 1] 1] 1]
dim 2: [1]: [1 [1 [1, 10] 10] 10]
--- ESMCI::Array::print end ---
PASS Print ESMC_Array object, ESMC_ArrayUTest.C, line 104
PASS Destroy ESMC_DistGrid object, ESMC_ArrayUTest.C, line 112
PASS Destroy ESMC_Array object, ESMC_ArrayUTest.C, line 120
Ending Test, file ESMC_ArrayUTest.C, line 124
Beginning Test, file ESMC_ArrayUTest.C, line 46
NUMBER_OF_PROCESSORS 4
PASS ArraySpecSet, ESMC_ArrayUTest.C, line 55
PASS Set up minIndex, ESMC_ArrayUTest.C, line 65
PASS Set up maxIndex, ESMC_ArrayUTest.C, line 76
PASS Create 5 x 10 ESMC_DistGrid object, ESMC_ArrayUTest.C, line 84
PASS Create ESMC_Array object, ESMC_ArrayUTest.C, line 96
--- ESMCI::Array::print start ---
 Base name    = array1
 Status: Base = Ready,  object = Ready
 Proxy        = no
 Root Info (Attributes):
{}Array typekind/rank: Integer*4 / 2 
~ lower class' values ~
DistGrid dimCount = 2
deCount = 4
localDeCount = 1
~ local data in LocalArray for DE 3 ~
LocalArrayPrint: Array at address 0x11277f0:
            rank = 2, typekind = 3, base_addr = 0x7efd5dfdfd40
            dim[0] = 1  dim[1] = 10  
  Integer, *4, Dim 2, Data values:
( 1, 1) =  1576926464
( 1, 2) =  32509
( 1, 3) =  544240928
( 1, 4) =  1232626029
( 1, 5) =  2019910766
( 1, 6) =  1397039148
( 1, 7) =  1096762189
( 1, 8) =  2036429426
( 1, 9) =  1936020565
( 1,10) =  742600308
dim 1: [0]: [1 [1 [1, 1] 1] 1]
dim 2: [1]: [1 [1 [1, 10] 10] 10]
--- ESMCI::Array::print end ---
PASS Print ESMC_Array object, ESMC_ArrayUTest.C, line 104
PASS Destroy ESMC_DistGrid object, ESMC_ArrayUTest.C, line 112
PASS Destroy ESMC_Array object, ESMC_ArrayUTest.C, line 120
Ending Test, file ESMC_ArrayUTest.C, line 124
Beginning Test, file ESMC_ArrayUTest.C, line 46
NUMBER_OF_PROCESSORS 4
PASS ArraySpecSet, ESMC_ArrayUTest.C, line 55
PASS Set up minIndex, ESMC_ArrayUTest.C, line 65
PASS Set up maxIndex, ESMC_ArrayUTest.C, line 76
PASS Create 5 x 10 ESMC_DistGrid object, ESMC_ArrayUTest.C, line 84
PASS Create ESMC_Array object, ESMC_ArrayUTest.C, line 96
--- ESMCI::Array::print start ---
 Base name    = array1
 Status: Base = Ready,  object = Ready
 Proxy        = no
 Root Info (Attributes):
{}Array typekind/rank: Integer*4 / 2 
~ lower class' values ~
DistGrid dimCount = 2
deCount = 4
localDeCount = 1
~ local data in LocalArray for DE 1 ~
LocalArrayPrint: Array at address 0x1c347f0:
            rank = 2, typekind = 3, base_addr = 0x7fe2d6a5bd40
            dim[0] = 1  dim[1] = 10  
  Integer, *4, Dim 2, Data values:
( 1, 1) =  -693781248
( 1, 2) =  32738
( 1, 3) =  544240928
( 1, 4) =  1232626029
( 1, 5) =  2019910766
( 1, 6) =  1397039148
( 1, 7) =  1096762189
( 1, 8) =  2036429426
( 1, 9) =  1936020565
( 1,10) =  742600308
dim 1: [0]: [1 [1 [1, 1] 1] 1]
dim 2: [1]: [1 [1 [1, 10] 10] 10]
--- ESMCI::Array::print end ---
PASS Print ESMC_Array object, ESMC_ArrayUTest.C, line 104
PASS Destroy ESMC_DistGrid object, ESMC_ArrayUTest.C, line 112
PASS Destroy ESMC_Array object, ESMC_ArrayUTest.C, line 120
Ending Test, file ESMC_ArrayUTest.C, line 124
 PET 1 Test Elapsed Time  3.144000 msec.
 PET 3 Test Elapsed Time  33.192000 msec.
 PET 2 Test Elapsed Time  54.933000 msec.
 PET 0 Test Elapsed Time  58.651000 msec.
TOTCPU=06:22:24 ELAP=00:11:57 REQMEM=5875Mc REQCPUS=24 ALLOCCPUS=32 TIMELIMIT=02:30:00 PART=s4 ACCT=star
MAXRSS=0 MAXVMSIZE=196896K
________________________________________________________________
Job Resource Usage Summary for 11456781

  CPU Time Used : 06:22:24
  Memory Used : 0
  Virtual Memory Used : 196896K
  Walltime Used : 00:11:57

  Memory Requested : 5875Mc (n=per node; c=per core)
  CPUs Requested / Allocated : 24 / 32
  Walltime Requested : 02:30:00

  Execution Queue : s4
  Head Node : 
  Charged to : star

  Job Stopped : Mon Oct  4 06:31:47 UTC 2021
_____________________________________________________________________

