build time -- 2022-02-17 06:22:40
Beginning Test, file ESMC_NlohmannJSONUTest.C, line 79
Beginning Test, file ESMC_NlohmannJSONUTest.C, line 79NUMBER_OF_PROCESSORS 4
PASS Basic JSON Map Creation, ESMC_NlohmannJSONUTest.C, line 112
PASS Reference and pointer access using the JSON API (1), ESMC_NlohmannJSONUTest.C, line 132
PASS Reference and pointer access using the JSON API (2), ESMC_NlohmannJSONUTest.C, line 144
PASS Reference and pointer access using the JSON API (3), ESMC_NlohmannJSONUTest.C, line 157
PASS Reference and pointer access using the JSON API (4), ESMC_NlohmannJSONUTest.C, line 169
PASS Reference and pointer access using the JSON API (5), ESMC_NlohmannJSONUTest.C, line 181
PASS Mock info constructor (1), ESMC_NlohmannJSONUTest.C, line 200
PASS Mock info constructor (2), ESMC_NlohmannJSONUTest.C, line 215
PASS Mock info constructor (3), ESMC_NlohmannJSONUTest.C, line 227
PASS Move constructor (1), ESMC_NlohmannJSONUTest.C, line 248
PASS Move constructor (2), ESMC_NlohmannJSONUTest.C, line 260
PASS Vector retrieval, ESMC_NlohmannJSONUTest.C, line 309
PASS Vector reservation, ESMC_NlohmannJSONUTest.C, line 332
PASS Pointer to internal information, ESMC_NlohmannJSONUTest.C, line 364
Beginning Test, file ESMC_NlohmannJSONUTest.C, line 79
Beginning Test, file ESMC_NlohmannJSONUTest.C, line 79NUMBER_OF_PROCESSORS 4
PASS Equality operator between in-memory and parse, ESMC_NlohmannJSONUTest.C, line 385
Ending Test, file ESMC_NlohmannJSONUTest.C, line 388
PASS Basic JSON Map Creation, ESMC_NlohmannJSONUTest.C, line 112
PASS Reference and pointer access using the JSON API (1), ESMC_NlohmannJSONUTest.C, line 132
PASS Reference and pointer access using the JSON API (2), ESMC_NlohmannJSONUTest.C, line 144
PASS Reference and pointer access using the JSON API (3), ESMC_NlohmannJSONUTest.C, line 157
PASS Reference and pointer access using the JSON API (4), ESMC_NlohmannJSONUTest.C, line 169
PASS Reference and pointer access using the JSON API (5), ESMC_NlohmannJSONUTest.C, line 181
PASS Mock info constructor (1), ESMC_NlohmannJSONUTest.C, line 200
PASS Mock info constructor (2), ESMC_NlohmannJSONUTest.C, line 215
PASS Mock info constructor (3), ESMC_NlohmannJSONUTest.C, line 227
PASS Move constructor (1), ESMC_NlohmannJSONUTest.C, line 248
PASS Move constructor (2), ESMC_NlohmannJSONUTest.C, line 260
PASS Vector retrieval, ESMC_NlohmannJSONUTest.C, line 309
PASS Vector reservation, ESMC_NlohmannJSONUTest.C, line 332
PASS Pointer to internal information, ESMC_NlohmannJSONUTest.C, line 364
PASS Equality operator between in-memory and parse, ESMC_NlohmannJSONUTest.C, line 385
Beginning Test, file ESMC_NlohmannJSONUTest.C, line 79
Beginning Test, file ESMC_NlohmannJSONUTest.C, line 79NUMBER_OF_PROCESSORS 4
Ending Test, file ESMC_NlohmannJSONUTest.C, line 388
PASS Basic JSON Map Creation, ESMC_NlohmannJSONUTest.C, line 112
PASS Reference and pointer access using the JSON API (1), ESMC_NlohmannJSONUTest.C, line 132
PASS Reference and pointer access using the JSON API (2), ESMC_NlohmannJSONUTest.C, line 144
PASS Reference and pointer access using the JSON API (3), ESMC_NlohmannJSONUTest.C, line 157
PASS Reference and pointer access using the JSON API (4), ESMC_NlohmannJSONUTest.C, line 169
PASS Reference and pointer access using the JSON API (5), ESMC_NlohmannJSONUTest.C, line 181
PASS Mock info constructor (1), ESMC_NlohmannJSONUTest.C, line 200
PASS Mock info constructor (2), ESMC_NlohmannJSONUTest.C, line 215
PASS Mock info constructor (3), ESMC_NlohmannJSONUTest.C, line 227
PASS Move constructor (1), ESMC_NlohmannJSONUTest.C, line 248
PASS Move constructor (2), ESMC_NlohmannJSONUTest.C, line 260
PASS Vector retrieval, ESMC_NlohmannJSONUTest.C, line 309
PASS Vector reservation, ESMC_NlohmannJSONUTest.C, line 332
PASS Pointer to internal information, ESMC_NlohmannJSONUTest.C, line 364
Beginning Test, file ESMC_NlohmannJSONUTest.C, line 79
Beginning Test, file ESMC_NlohmannJSONUTest.C, line 79NUMBER_OF_PROCESSORS 4
PASS Equality operator between in-memory and parse, ESMC_NlohmannJSONUTest.C, line 385
Ending Test, file ESMC_NlohmannJSONUTest.C, line 388
PASS Basic JSON Map Creation, ESMC_NlohmannJSONUTest.C, line 112
PASS Reference and pointer access using the JSON API (1), ESMC_NlohmannJSONUTest.C, line 132
PASS Reference and pointer access using the JSON API (2), ESMC_NlohmannJSONUTest.C, line 144
PASS Reference and pointer access using the JSON API (3), ESMC_NlohmannJSONUTest.C, line 157
PASS Reference and pointer access using the JSON API (4), ESMC_NlohmannJSONUTest.C, line 169
PASS Reference and pointer access using the JSON API (5), ESMC_NlohmannJSONUTest.C, line 181
PASS Mock info constructor (1), ESMC_NlohmannJSONUTest.C, line 200
PASS Mock info constructor (2), ESMC_NlohmannJSONUTest.C, line 215
PASS Mock info constructor (3), ESMC_NlohmannJSONUTest.C, line 227
PASS Move constructor (1), ESMC_NlohmannJSONUTest.C, line 248
PASS Move constructor (2), ESMC_NlohmannJSONUTest.C, line 260
PASS Vector retrieval, ESMC_NlohmannJSONUTest.C, line 309
PASS Vector reservation, ESMC_NlohmannJSONUTest.C, line 332
PASS Pointer to internal information, ESMC_NlohmannJSONUTest.C, line 364
PASS Equality operator between in-memory and parse, ESMC_NlohmannJSONUTest.C, line 385
Ending Test, file ESMC_NlohmannJSONUTest.C, line 388
Ending Test, file ESMC_NlohmannJSONUTest.C, line 388 PET 2 Test Elapsed Time 4.854 msec.
Ending Test, file ESMC_NlohmannJSONUTest.C, line 388 PET 1 Test Elapsed Time 4.23 msec.
Ending Test, file ESMC_NlohmannJSONUTest.C, line 388 PET 3 Test Elapsed Time 5.682 msec.
Ending Test, file ESMC_NlohmannJSONUTest.C, line 388 PET 0 Test Elapsed Time 4.492 msec.
TOTCPU=05:20:00 ELAP=00:10:00 REQMEM=5875Mc REQCPUS=24 ALLOCCPUS=32 TIMELIMIT=02:30:00 PART=s4 ACCT=star
MAXRSS=0 MAXVMSIZE=196896K
________________________________________________________________
Job Resource Usage Summary for 11995272

  CPU Time Used : 05:20:00
  Memory Used : 0
  Virtual Memory Used : 196896K
  Walltime Used : 00:10:00

  Memory Requested : 5875Mc (n=per node; c=per core)
  CPUs Requested / Allocated : 24 / 32
  Walltime Requested : 02:30:00

  Execution Queue : s4
  Head Node : 
  Charged to : star

  Job Stopped : Thu Feb 17 06:32:41 UTC 2022
_____________________________________________________________________

