build time -- 2022-01-23 06:18:43
Beginning Test, file ESMC_ClockUTest.C, line 48
NUMBER_OF_PROCESSORS 4
PASS Create ESMC_Calendar object, ESMC_ClockUTest.C, line 71
PASS Set Start Time, ESMC_ClockUTest.C, line 79
PASS Set Stop Time, ESMC_ClockUTest.C, line 87
PASS Set a TimeInterval, ESMC_ClockUTest.C, line 95
PASS Create ESMC_Clock object, ESMC_ClockUTest.C, line 103
Clock ----------------------------------
name = TEST_CLOCK
timeStep = 
TimeInterval ---------------------------
P0Y0M0DT1H0M0S
end TimeInterval -----------------------

startTime = 
Time -----------------------------------
2006-01-01T00:00:00
end Time -------------------------------

stopTime = 
Time -----------------------------------
2006-01-01T01:00:00
end Time -------------------------------

stopTimeEnabled = true
refTime = 
Time -----------------------------------
2006-01-01T00:00:00
end Time -------------------------------

currTime = 
Time -----------------------------------
2006-01-01T00:00:00
end Time -------------------------------

prevTime = 
Time -----------------------------------
2006-01-01T00:00:00
end Time -------------------------------

advanceCount = 0
direction = 1
userChangedDirection = false
alarmCount = 0
alarmList = 
end Clock ------------------------------

PASS Print ESMC_Clock object, ESMC_ClockUTest.C, line 111
PASS Get ESMC_Clock object current time and advance count, ESMC_ClockUTest.C, line 119
PASS Advance the Clock object, ESMC_ClockUTest.C, line 127
PASS Get ESMC_Clock object current time and advance count, ESMC_ClockUTest.C, line 136
PASS Get currSimTime in seconds and in hours, ESMC_ClockUTest.C, line 144
PASS Verify that currSimTime in second units, ESMC_ClockUTest.C, line 151
PASS Verify that currSimTime in hour units, ESMC_ClockUTest.C, line 159
PASS Destroy ESMC_Clock object, ESMC_ClockUTest.C, line 168
PASS Destroy ESMC_Calendar object, ESMC_ClockUTest.C, line 176
Ending Test, file ESMC_ClockUTest.C, line 287
Beginning Test, file ESMC_ClockUTest.C, line 48
NUMBER_OF_PROCESSORS 4
PASS Create ESMC_Calendar object, ESMC_ClockUTest.C, line 71
PASS Set Start Time, ESMC_ClockUTest.C, line 79
PASS Set Stop Time, ESMC_ClockUTest.C, line 87
PASS Set a TimeInterval, ESMC_ClockUTest.C, line 95
PASS Create ESMC_Clock object, ESMC_ClockUTest.C, line 103
Clock ----------------------------------
name = TEST_CLOCK
timeStep = 
TimeInterval ---------------------------
P0Y0M0DT1H0M0S
end TimeInterval -----------------------

startTime = 
Time -----------------------------------
2006-01-01T00:00:00
end Time -------------------------------

stopTime = 
Time -----------------------------------
2006-01-01T01:00:00
end Time -------------------------------

stopTimeEnabled = true
refTime = 
Time -----------------------------------
2006-01-01T00:00:00
end Time -------------------------------

currTime = 
Time -----------------------------------
2006-01-01T00:00:00
end Time -------------------------------

prevTime = 
Time -----------------------------------
2006-01-01T00:00:00
end Time -------------------------------

advanceCount = 0
direction = 1
userChangedDirection = false
alarmCount = 0
alarmList = 
end Clock ------------------------------

PASS Print ESMC_Clock object, ESMC_ClockUTest.C, line 111
PASS Get ESMC_Clock object current time and advance count, ESMC_ClockUTest.C, line 119
PASS Advance the Clock object, ESMC_ClockUTest.C, line 127
PASS Get ESMC_Clock object current time and advance count, ESMC_ClockUTest.C, line 136
PASS Get currSimTime in seconds and in hours, ESMC_ClockUTest.C, line 144
PASS Verify that currSimTime in second units, ESMC_ClockUTest.C, line 151
PASS Verify that currSimTime in hour units, ESMC_ClockUTest.C, line 159
PASS Destroy ESMC_Clock object, ESMC_ClockUTest.C, line 168
PASS Destroy ESMC_Calendar object, ESMC_ClockUTest.C, line 176
Ending Test, file ESMC_ClockUTest.C, line 287
Beginning Test, file ESMC_ClockUTest.C, line 48
NUMBER_OF_PROCESSORS 4
PASS Create ESMC_Calendar object, ESMC_ClockUTest.C, line 71
PASS Set Start Time, ESMC_ClockUTest.C, line 79
PASS Set Stop Time, ESMC_ClockUTest.C, line 87
PASS Set a TimeInterval, ESMC_ClockUTest.C, line 95
PASS Create ESMC_Clock object, ESMC_ClockUTest.C, line 103
Clock ----------------------------------
name = TEST_CLOCK
timeStep = 
TimeInterval ---------------------------
P0Y0M0DT1H0M0S
end TimeInterval -----------------------

startTime = 
Time -----------------------------------
2006-01-01T00:00:00
end Time -------------------------------

stopTime = 
Time -----------------------------------
2006-01-01T01:00:00
end Time -------------------------------

stopTimeEnabled = true
refTime = 
Time -----------------------------------
2006-01-01T00:00:00
end Time -------------------------------

currTime = 
Time -----------------------------------
2006-01-01T00:00:00
end Time -------------------------------

prevTime = 
Time -----------------------------------
2006-01-01T00:00:00
end Time -------------------------------

advanceCount = 0
direction = 1
userChangedDirection = false
alarmCount = 0
alarmList = 
end Clock ------------------------------

PASS Print ESMC_Clock object, ESMC_ClockUTest.C, line 111
PASS Get ESMC_Clock object current time and advance count, ESMC_ClockUTest.C, line 119
PASS Advance the Clock object, ESMC_ClockUTest.C, line 127
PASS Get ESMC_Clock object current time and advance count, ESMC_ClockUTest.C, line 136
PASS Get currSimTime in seconds and in hours, ESMC_ClockUTest.C, line 144
PASS Verify that currSimTime in second units, ESMC_ClockUTest.C, line 151
PASS Verify that currSimTime in hour units, ESMC_ClockUTest.C, line 159
PASS Destroy ESMC_Clock object, ESMC_ClockUTest.C, line 168
PASS Destroy ESMC_Calendar object, ESMC_ClockUTest.C, line 176
Ending Test, file ESMC_ClockUTest.C, line 287
Beginning Test, file ESMC_ClockUTest.C, line 48
NUMBER_OF_PROCESSORS 4
PASS Create ESMC_Calendar object, ESMC_ClockUTest.C, line 71
PASS Set Start Time, ESMC_ClockUTest.C, line 79
PASS Set Stop Time, ESMC_ClockUTest.C, line 87
PASS Set a TimeInterval, ESMC_ClockUTest.C, line 95
PASS Create ESMC_Clock object, ESMC_ClockUTest.C, line 103
Clock ----------------------------------
name = TEST_CLOCK
timeStep = 
TimeInterval ---------------------------
P0Y0M0DT1H0M0S
end TimeInterval -----------------------

startTime = 
Time -----------------------------------
2006-01-01T00:00:00
end Time -------------------------------

stopTime = 
Time -----------------------------------
2006-01-01T01:00:00
end Time -------------------------------

stopTimeEnabled = true
refTime = 
Time -----------------------------------
2006-01-01T00:00:00
end Time -------------------------------

currTime = 
Time -----------------------------------
2006-01-01T00:00:00
end Time -------------------------------

prevTime = 
Time -----------------------------------
2006-01-01T00:00:00
end Time -------------------------------

advanceCount = 0
direction = 1
userChangedDirection = false
alarmCount = 0
alarmList = 
end Clock ------------------------------

PASS Print ESMC_Clock object, ESMC_ClockUTest.C, line 111
PASS Get ESMC_Clock object current time and advance count, ESMC_ClockUTest.C, line 119
PASS Advance the Clock object, ESMC_ClockUTest.C, line 127
PASS Get ESMC_Clock object current time and advance count, ESMC_ClockUTest.C, line 136
PASS Get currSimTime in seconds and in hours, ESMC_ClockUTest.C, line 144
PASS Verify that currSimTime in second units, ESMC_ClockUTest.C, line 151
PASS Verify that currSimTime in hour units, ESMC_ClockUTest.C, line 159
PASS Destroy ESMC_Clock object, ESMC_ClockUTest.C, line 168
PASS Destroy ESMC_Calendar object, ESMC_ClockUTest.C, line 176
Ending Test, file ESMC_ClockUTest.C, line 287
 PET 1 Test Elapsed Time  5.980000 msec.
result = 0
 PET 0 Test Elapsed Time  8.244000 msec.
result = 0
 PET 3 Test Elapsed Time  7.611000 msec.
result = 0
 PET 2 Test Elapsed Time  5.618000 msec.
result = 0
TOTCPU=06:49:36 ELAP=00:12:48 REQMEM=5875Mc REQCPUS=24 ALLOCCPUS=32 TIMELIMIT=02:30:00 PART=s4 ACCT=star
MAXRSS=36616K MAXVMSIZE=196896K
________________________________________________________________
Job Resource Usage Summary for 11865934

  CPU Time Used : 06:49:36
  Memory Used : 36616K
  Virtual Memory Used : 196896K
  Walltime Used : 00:12:48

  Memory Requested : 5875Mc (n=per node; c=per core)
  CPUs Requested / Allocated : 24 / 32
  Walltime Requested : 02:30:00

  Execution Queue : s4
  Head Node : 
  Charged to : star

  Job Stopped : Sun Jan 23 06:31:32 UTC 2022
_____________________________________________________________________

