build time -- 2021-10-06 06:24:09
Beginning Test, file ESMC_ArrayUTest.C, line 46
NUMBER_OF_PROCESSORS 4
PASS ArraySpecSet, ESMC_ArrayUTest.C, line 55
PASS Set up minIndex, ESMC_ArrayUTest.C, line 65
PASS Set up maxIndex, ESMC_ArrayUTest.C, line 76
PASS Create 5 x 10 ESMC_DistGrid object, ESMC_ArrayUTest.C, line 84
--- ESMCI::Array::print start ---
PASS Create ESMC_Array object, ESMC_ArrayUTest.C, line 96
 Base name    = array1
 Status: Base = Ready,  object = Ready
 Proxy        = no
 Root Info (Attributes):
{}Array typekind/rank: Integer*4 / 2 
~ lower class' values ~
DistGrid dimCount = 2
deCount = 4
localDeCount = 1
~ local data in LocalArray for DE 3 ~
LocalArrayPrint: Array at address 0x28307f0:
            rank = 2, typekind = 3, base_addr = 0x2b792e32fd40
            dim[0] = 1  dim[1] = 10  
  Integer, *4, Dim 2, Data values:
( 1, 1) =  775093504
( 1, 2) =  11129
( 1, 3) =  544240928
( 1, 4) =  1232626029
( 1, 5) =  2019910766
( 1, 6) =  1397039148
( 1, 7) =  1096762189
( 1, 8) =  2036429426
( 1, 9) =  1936020565
( 1,10) =  742600308
dim 1: [0]: [1 [1 [1, 1] 1] 1]
dim 2: [1]: [1 [1 [1, 10] 10] 10]
--- ESMCI::Array::print end ---
PASS Print ESMC_Array object, ESMC_ArrayUTest.C, line 104
PASS Destroy ESMC_DistGrid object, ESMC_ArrayUTest.C, line 112
PASS Destroy ESMC_Array object, ESMC_ArrayUTest.C, line 120
Ending Test, file ESMC_ArrayUTest.C, line 124
Beginning Test, file ESMC_ArrayUTest.C, line 46
NUMBER_OF_PROCESSORS 4
PASS ArraySpecSet, ESMC_ArrayUTest.C, line 55
PASS Set up minIndex, ESMC_ArrayUTest.C, line 65
PASS Set up maxIndex, ESMC_ArrayUTest.C, line 76
PASS Create 5 x 10 ESMC_DistGrid object, ESMC_ArrayUTest.C, line 84
PASS Create ESMC_Array object, ESMC_ArrayUTest.C, line 96
--- ESMCI::Array::print start ---
 Base name    = array1
 Status: Base = Ready,  object = Ready
 Proxy        = no
 Root Info (Attributes):
{}Array typekind/rank: Integer*4 / 2 
~ lower class' values ~
DistGrid dimCount = 2
deCount = 4
localDeCount = 1
~ local data in LocalArray for DE 1 ~
LocalArrayPrint: Array at address 0x1cbd7e0:
            rank = 2, typekind = 3, base_addr = 0x2b8165aefd40
            dim[0] = 1  dim[1] = 10  
  Integer, *4, Dim 2, Data values:
( 1, 1) =  1705966848
( 1, 2) =  11137
( 1, 3) =  544240928
( 1, 4) =  1232626029
( 1, 5) =  2019910766
( 1, 6) =  1397039148
( 1, 7) =  1096762189
( 1, 8) =  2036429426
( 1, 9) =  1936020565
( 1,10) =  742600308
dim 1: [0]: [1 [1 [1, 1] 1] 1]
dim 2: [1]: [1 [1 [1, 10] 10] 10]
--- ESMCI::Array::print end ---
PASS Print ESMC_Array object, ESMC_ArrayUTest.C, line 104
PASS Destroy ESMC_DistGrid object, ESMC_ArrayUTest.C, line 112
PASS Destroy ESMC_Array object, ESMC_ArrayUTest.C, line 120
Ending Test, file ESMC_ArrayUTest.C, line 124
Beginning Test, file ESMC_ArrayUTest.C, line 46
NUMBER_OF_PROCESSORS 4
PASS ArraySpecSet, ESMC_ArrayUTest.C, line 55
PASS Set up minIndex, ESMC_ArrayUTest.C, line 65
PASS Set up maxIndex, ESMC_ArrayUTest.C, line 76
PASS Create 5 x 10 ESMC_DistGrid object, ESMC_ArrayUTest.C, line 84
PASS Create ESMC_Array object, ESMC_ArrayUTest.C, line 96
--- ESMCI::Array::print start ---
 Base name    = array1
 Status: Base = Ready,  object = Ready
 Proxy        = no
 Root Info (Attributes):
{}Array typekind/rank: Integer*4 / 2 
~ lower class' values ~
DistGrid dimCount = 2
deCount = 4
localDeCount = 1
~ local data in LocalArray for DE 0 ~
LocalArrayPrint: Array at address 0x270a290:
            rank = 2, typekind = 3, base_addr = 0x2ac67689ffa0
            dim[0] = 2  dim[1] = 10  
  Integer, *4, Dim 2, Data values:
( 1, 1) =  1397965136
( 2, 1) =  1701987104
( 1, 2) =  543519841
( 2, 2) =  544743477
( 1, 3) =  1159737393
( 2, 3) =  1598246227
( 1, 4) =  1953720644
( 2, 4) =  1684632135
( 1, 5) =  1784835872
( 2, 5) =  745825125
( 1, 6) =  1297302816
( 2, 6) =  1916886851
( 1, 7) =  1434018162
( 2, 7) =  1953719636
( 1, 8) =  539771694
( 2, 8) =  1701734764
( 1, 9) =  926169120
( 2, 9) =  0
( 1,10) =  0
( 2,10) =  0
dim 1: [0]: [1 [1 [1, 2] 2] 2]
dim 2: [1]: [1 [1 [1, 10] 10] 10]
--- ESMCI::Array::print end ---
PASS Print ESMC_Array object, ESMC_ArrayUTest.C, line 104
PASS Destroy ESMC_DistGrid object, ESMC_ArrayUTest.C, line 112
PASS Destroy ESMC_Array object, ESMC_ArrayUTest.C, line 120
Ending Test, file ESMC_ArrayUTest.C, line 124
Beginning Test, file ESMC_ArrayUTest.C, line 46
NUMBER_OF_PROCESSORS 4
PASS ArraySpecSet, ESMC_ArrayUTest.C, line 55
PASS Set up minIndex, ESMC_ArrayUTest.C, line 65
PASS Set up maxIndex, ESMC_ArrayUTest.C, line 76
PASS Create 5 x 10 ESMC_DistGrid object, ESMC_ArrayUTest.C, line 84
PASS Create ESMC_Array object, ESMC_ArrayUTest.C, line 96
--- ESMCI::Array::print start ---
 Base name    = array1
 Status: Base = Ready,  object = Ready
 Proxy        = no
 Root Info (Attributes):
{}Array typekind/rank: Integer*4 / 2 
~ lower class' values ~
DistGrid dimCount = 2
deCount = 4
localDeCount = 1
~ local data in LocalArray for DE 2 ~
LocalArrayPrint: Array at address 0x1b667e0:
            rank = 2, typekind = 3, base_addr = 0x2b613b38fd40
            dim[0] = 1  dim[1] = 10  
  Integer, *4, Dim 2, Data values:
( 1, 1) =  993590528
( 1, 2) =  11105
( 1, 3) =  544240928
( 1, 4) =  1232626029
( 1, 5) =  2019910766
( 1, 6) =  1397039148
( 1, 7) =  1096762189
( 1, 8) =  2036429426
( 1, 9) =  1936020565
( 1,10) =  742600308
dim 1: [0]: [1 [1 [1, 1] 1] 1]
dim 2: [1]: [1 [1 [1, 10] 10] 10]
--- ESMCI::Array::print end ---
PASS Print ESMC_Array object, ESMC_ArrayUTest.C, line 104
PASS Destroy ESMC_DistGrid object, ESMC_ArrayUTest.C, line 112
PASS Destroy ESMC_Array object, ESMC_ArrayUTest.C, line 120
Ending Test, file ESMC_ArrayUTest.C, line 124
 PET 1 Test Elapsed Time  31.762000 msec.
 PET 3 Test Elapsed Time  39.781000 msec.
 PET 2 Test Elapsed Time  6.793000 msec.
 PET 0 Test Elapsed Time  21.740000 msec.
TOTCPU=08:19:44 ELAP=00:15:37 REQMEM=5875Mc REQCPUS=24 ALLOCCPUS=32 TIMELIMIT=02:30:00 PART=s4 ACCT=star
MAXRSS=0 MAXVMSIZE=196896K
________________________________________________________________
Job Resource Usage Summary for 11468808

  CPU Time Used : 08:19:44
  Memory Used : 0
  Virtual Memory Used : 196896K
  Walltime Used : 00:15:37

  Memory Requested : 5875Mc (n=per node; c=per core)
  CPUs Requested / Allocated : 24 / 32
  Walltime Requested : 02:30:00

  Execution Queue : s4
  Head Node : 
  Charged to : star

  Job Stopped : Wed Oct  6 06:39:47 UTC 2021
_____________________________________________________________________

