build time -- 2021-10-04 06:19:50
 --------------------------------------- 
 Start of  System Test ESMF_ArraySharedDeSSISTest
 --------------------------------------- 
 --------------------------------------- 
 Start of  System Test ESMF_ArraySharedDeSSISTest
 --------------------------------------- 
 --------------------------------------- 
 Start of  System Test ESMF_ArraySharedDeSSISTest
 --------------------------------------- 
 --------------------------------------- 
 Start of  System Test ESMF_ArraySharedDeSSISTest
 --------------------------------------- 
 --------------------------------------- 
 Start of  System Test ESMF_ArraySharedDeSSISTest
 --------------------------------------- 
 --------------------------------------- 
 Start of  System Test ESMF_ArraySharedDeSSISTest
 --------------------------------------- 
  System Test ESMF_ArraySharedDeSSISTest                                        
                                                                                
                                                                                
                     complete.
 ------------------------------------------------------------
 ------------------------------------------------------------
 Test finished, localPet =            3
 ------------------------------------------------------------
 ------------------------------------------------------------
  PASS  System Test ESMF_ArraySharedDeSSISTest, ESMF_ArraySharedDeSSISTest.F90, 
 line 297
 
  System Test ESMF_ArraySharedDeSSISTest
  SUCCESS:  System Test ESMF_ArraySharedDeSSISTest finished correctly.
 
  System Test ESMF_ArraySharedDeSSISTest                                        
                                                                                
                                                                                
                     complete.
 ------------------------------------------------------------
 ------------------------------------------------------------
 Test finished, localPet =            4
 ------------------------------------------------------------
 ------------------------------------------------------------
  System Test ESMF_ArraySharedDeSSISTest                                        
                                                                                
                                                                                
                     complete.
 ------------------------------------------------------------
 ------------------------------------------------------------
 Test finished, localPet =            5
 ------------------------------------------------------------
 ------------------------------------------------------------
  PASS  System Test ESMF_ArraySharedDeSSISTest, ESMF_ArraySharedDeSSISTest.F90, 
 line 297
 
  System Test ESMF_ArraySharedDeSSISTest
  SUCCESS:  System Test ESMF_ArraySharedDeSSISTest finished correctly.
 
  PASS  System Test ESMF_ArraySharedDeSSISTest, ESMF_ArraySharedDeSSISTest.F90, 
 line 297
 
  System Test ESMF_ArraySharedDeSSISTest
  SUCCESS:  System Test ESMF_ArraySharedDeSSISTest finished correctly.
 
  System Test ESMF_ArraySharedDeSSISTest                                        
                                                                                
                                                                                
                     complete.
 ------------------------------------------------------------
 ------------------------------------------------------------
 Test finished, localPet =            0
 ------------------------------------------------------------
 ------------------------------------------------------------
  PASS  System Test ESMF_ArraySharedDeSSISTest, ESMF_ArraySharedDeSSISTest.F90, 
 line 297
 
  System Test ESMF_ArraySharedDeSSISTest
  SUCCESS:  System Test ESMF_ArraySharedDeSSISTest finished correctly.
 
  System Test ESMF_ArraySharedDeSSISTest                                        
                                                                                
                                                                                
                     complete.
  System Test ESMF_ArraySharedDeSSISTest                                        
                                                                                
                                                                                
                     complete.
 ------------------------------------------------------------
 ------------------------------------------------------------
 Test finished, localPet =            1
 ------------------------------------------------------------
 ------------------------------------------------------------
 
  System Test ESMF_ArraySharedDeSSISTest
  SUCCESS:  System Test ESMF_ArraySharedDeSSISTest finished correctly.
 
 ------------------------------------------------------------
 ------------------------------------------------------------
 Test finished, localPet =            2
 ------------------------------------------------------------
 ------------------------------------------------------------
  PASS  System Test ESMF_ArraySharedDeSSISTest, ESMF_ArraySharedDeSSISTest.F90, 
 line 297
 
  System Test ESMF_ArraySharedDeSSISTest
  SUCCESS:  System Test ESMF_ArraySharedDeSSISTest finished correctly.
 
  PASS  System Test ESMF_ArraySharedDeSSISTest, ESMF_ArraySharedDeSSISTest.F90, 
 line 297
Abort(806969871) on node 1 (rank 1 in comm 0): Fatal error in PMPI_Finalize: Other MPI error, error stack:
PMPI_Finalize(367)...............: MPI_Finalize failed
PMPI_Finalize(278)...............: 
MPID_Finalize(1033)..............: 
MPIDI_OFI_mpi_finalize_hook(1579): OFI domain close failed (ofi_init.c:1579:MPIDI_OFI_mpi_finalize_hook:Device or resource busy)
In: PMI_Abort(806969871, Fatal error in PMPI_Finalize: Other MPI error, error stack:
PMPI_Finalize(367)...............: MPI_Finalize failed
PMPI_Finalize(278)...............: 
MPID_Finalize(1033)..............: 
MPIDI_OFI_mpi_finalize_hook(1579): OFI domain close failed (ofi_init.c:1579:MPIDI_OFI_mpi_finalize_hook:Device or resource busy))
Abort(806969871) on node 5 (rank 5 in comm 0): Fatal error in PMPI_Finalize: Other MPI error, error stack:
PMPI_Finalize(367)...............: MPI_Finalize failed
PMPI_Finalize(278)...............: 
MPID_Finalize(1033)..............: 
MPIDI_OFI_mpi_finalize_hook(1579): OFI domain close failed (ofi_init.c:1579:MPIDI_OFI_mpi_finalize_hook:Device or resource busy)
In: PMI_Abort(806969871, Fatal error in PMPI_Finalize: Other MPI error, error stack:
PMPI_Finalize(367)...............: MPI_Finalize failed
PMPI_Finalize(278)...............: 
MPID_Finalize(1033)..............: 
MPIDI_OFI_mpi_finalize_hook(1579): OFI domain close failed (ofi_init.c:1579:MPIDI_OFI_mpi_finalize_hook:Device or resource busy))
Abort(806969871) on node 4 (rank 4 in comm 0): Fatal error in PMPI_Finalize: Other MPI error, error stack:
PMPI_Finalize(367)...............: MPI_Finalize failed
PMPI_Finalize(278)...............: 
MPID_Finalize(1033)..............: 
MPIDI_OFI_mpi_finalize_hook(1579): OFI domain close failed (ofi_init.c:1579:MPIDI_OFI_mpi_finalize_hook:Device or resource busy)
In: PMI_Abort(806969871, Fatal error in PMPI_Finalize: Other MPI error, error stack:
PMPI_Finalize(367)...............: MPI_Finalize failed
PMPI_Finalize(278)...............: 
MPID_Finalize(1033)..............: 
MPIDI_OFI_mpi_finalize_hook(1579): OFI domain close failed (ofi_init.c:1579:MPIDI_OFI_mpi_finalize_hook:Device or resource busy))
Abort(806969871) on node 3 (rank 3 in comm 0): Fatal error in PMPI_Finalize: Other MPI error, error stack:
PMPI_Finalize(367)...............: MPI_Finalize failed
PMPI_Finalize(278)...............: 
MPID_Finalize(1033)..............: 
MPIDI_OFI_mpi_finalize_hook(1579): OFI domain close failed (ofi_init.c:1579:MPIDI_OFI_mpi_finalize_hook:Device or resource busy)
In: PMI_Abort(806969871, Fatal error in PMPI_Finalize: Other MPI error, error stack:
PMPI_Finalize(367)...............: MPI_Finalize failed
PMPI_Finalize(278)...............: 
MPID_Finalize(1033)..............: 
MPIDI_OFI_mpi_finalize_hook(1579): OFI domain close failed (ofi_init.c:1579:MPIDI_OFI_mpi_finalize_hook:Device or resource busy))
Abort(806969871) on node 0 (rank 0 in comm 0): Fatal error in PMPI_Finalize: Other MPI error, error stack:
PMPI_Finalize(367)...............: MPI_Finalize failed
PMPI_Finalize(278)...............: 
MPID_Finalize(1033)..............: 
MPIDI_OFI_mpi_finalize_hook(1579): OFI domain close failed (ofi_init.c:1579:MPIDI_OFI_mpi_finalize_hook:Device or resource busy)
Abort(806969871) on node 2 (rank 2 in comm 0): Fatal error in PMPI_Finalize: Other MPI error, error stack:
PMPI_Finalize(367)...............: MPI_Finalize failed
PMPI_Finalize(278)...............: 
MPID_Finalize(1033)..............: 
MPIDI_OFI_mpi_finalize_hook(1579): OFI domain close failed (ofi_init.c:1579:MPIDI_OFI_mpi_finalize_hook:Device or resource busy)
In: PMI_Abort(806969871, Fatal error in PMPI_Finalize: Other MPI error, error stack:
PMPI_Finalize(367)...............: MPI_Finalize failed
PMPI_Finalize(278)...............: 
MPID_Finalize(1033)..............: 
MPIDI_OFI_mpi_finalize_hook(1579): OFI domain close failed (ofi_init.c:1579:MPIDI_OFI_mpi_finalize_hook:Device or resource busy))
In: PMI_Abort(806969871, Fatal error in PMPI_Finalize: Other MPI error, error stack:
PMPI_Finalize(367)...............: MPI_Finalize failed
PMPI_Finalize(278)...............: 
MPID_Finalize(1033)..............: 
MPIDI_OFI_mpi_finalize_hook(1579): OFI domain close failed (ofi_init.c:1579:MPIDI_OFI_mpi_finalize_hook:Device or resource busy))
srun: Job step aborted: Waiting up to 32 seconds for job step to finish.
slurmstepd: error: *** STEP 11456781.221 ON s4-203-c4 CANCELLED AT 2021-10-04T06:45:13 ***
srun: error: s4-203-c4: tasks 0-5: Killed
srun: Terminating job step 11456781.221
TOTCPU=13:32:48 ELAP=00:25:24 REQMEM=5875Mc REQCPUS=24 ALLOCCPUS=32 TIMELIMIT=02:30:00 PART=s4 ACCT=star
MAXRSS=61896K MAXVMSIZE=3369932K
________________________________________________________________
Job Resource Usage Summary for 11456781

  CPU Time Used : 13:32:48
  Memory Used : 61896K
  Virtual Memory Used : 3369932K
  Walltime Used : 00:25:24

  Memory Requested : 5875Mc (n=per node; c=per core)
  CPUs Requested / Allocated : 24 / 32
  Walltime Requested : 02:30:00

  Execution Queue : s4
  Head Node : 
  Charged to : star

  Job Stopped : Mon Oct  4 06:45:13 UTC 2021
_____________________________________________________________________

