build time -- 2021-10-04 06:19:50
 System Test FieldRedistArb2Arb.
 System Test FieldRedistArb2Arb.
 System Test FieldRedistArb2Arb.
 System Test FieldRedistArb2Arb.
 System Test FieldRedistArb2Arb.
 System Test FieldRedistArb2Arb.
 Create section finished
 Create section finished
 Create section finished
 Create section finished
 Create section finished
 Create section finished
 Initial data, before Redistribution:
 Init section finished
 Initial data, before Redistribution:
 Init section finished
 Initial data, before Redistribution:
 Init section finished
 Initial data, before Redistribution:
 Init section finished
 Initial data, before Redistribution:
 Init section finished
 Initial data, before Redistribution:
 Init section finished
 Array contents after Transpose:
 Array contents after Transpose:
 Array contents after Transpose:
 Array contents after Transpose:
 Array contents after Transpose:
 Array contents after Transpose:
 Array contents after second Redistribution, should match original:
 Run section finished
 -----------------------------------------------------------------
 -----------------------------------------------------------------
 Result from PET number            0
 -----------------------------------------------------------------
 -----------------------------------------------------------------
 Array contents matched correctly!! PET =            0
 Finalize section finished
 Array contents after second Redistribution, should match original:
 Run section finished
 -----------------------------------------------------------------
 -----------------------------------------------------------------
 Result from PET number            1
 -----------------------------------------------------------------
 -----------------------------------------------------------------
 Array contents matched correctly!! PET =            1
 Finalize section finished
 Array contents after second Redistribution, should match original:
 Run section finished
 -----------------------------------------------------------------
 -----------------------------------------------------------------
 Result from PET number            2
 -----------------------------------------------------------------
 -----------------------------------------------------------------
 Array contents matched correctly!! PET =            2
 Finalize section finished
 Array contents after second Redistribution, should match original:
 Run section finished
 -----------------------------------------------------------------
 -----------------------------------------------------------------
 Result from PET number            3
 -----------------------------------------------------------------
 -----------------------------------------------------------------
 Array contents matched correctly!! PET =            3
 Finalize section finished
 Array contents after second Redistribution, should match original:
 Run section finished
 -----------------------------------------------------------------
 -----------------------------------------------------------------
 Result from PET number            4
 -----------------------------------------------------------------
 -----------------------------------------------------------------
 Array contents matched correctly!! PET =            4
 Finalize section finished
 Array contents after second Redistribution, should match original:
 Run section finished
 -----------------------------------------------------------------
 -----------------------------------------------------------------
 Result from PET number            5
 -----------------------------------------------------------------
 -----------------------------------------------------------------
 Array contents matched correctly!! PET =            5
 Finalize section finished
 All Destroy routines done
 System Test FieldRedistArb2Arb complete.
 All Destroy routines done
 System Test FieldRedistArb2Arb complete.
 All Destroy routines done
 System Test FieldRedistArb2Arb complete.
 All Destroy routines done
 System Test FieldRedistArb2Arb complete.
 All Destroy routines done
 System Test FieldRedistArb2Arb complete.
 All Destroy routines done
 System Test FieldRedistArb2Arb complete.
  PASS  System Test FieldRedistArb2Arb: Field Redistribute, ESMF_FieldRedistArb2
 ArbSTest.F90, line 333
  PASS  System Test FieldRedistArb2Arb: Field Redistribute, ESMF_FieldRedistArb2
 ArbSTest.F90, line 333
  PASS  System Test FieldRedistArb2Arb: Field Redistribute, ESMF_FieldRedistArb2
 ArbSTest.F90, line 333
  PASS  System Test FieldRedistArb2Arb: Field Redistribute, ESMF_FieldRedistArb2
 ArbSTest.F90, line 333
  PASS  System Test FieldRedistArb2Arb: Field Redistribute, ESMF_FieldRedistArb2
 ArbSTest.F90, line 333
  PASS  System Test FieldRedistArb2Arb: Field Redistribute, ESMF_FieldRedistArb2
 ArbSTest.F90, line 333
TOTCPU=13:46:08 ELAP=00:25:49 REQMEM=5875Mc REQCPUS=24 ALLOCCPUS=32 TIMELIMIT=02:30:00 PART=s4 ACCT=star
MAXRSS=15832K MAXVMSIZE=196896K
________________________________________________________________
Job Resource Usage Summary for 11456781

  CPU Time Used : 13:46:08
  Memory Used : 15832K
  Virtual Memory Used : 196896K
  Walltime Used : 00:25:49

  Memory Requested : 5875Mc (n=per node; c=per core)
  CPUs Requested / Allocated : 24 / 32
  Walltime Requested : 02:30:00

  Execution Queue : s4
  Head Node : 
  Charged to : star

  Job Stopped : Mon Oct  4 06:45:39 UTC 2021
_____________________________________________________________________

