build time -- 2022-01-22 06:24:48
 System Test FieldRedistBlk2Arb.
 System Test FieldRedistBlk2Arb.
 System Test FieldRedistBlk2Arb.
 System Test FieldRedistBlk2Arb.
 System Test FieldRedistBlk2Arb.
 System Test FieldRedistBlk2Arb.
 Create section finished
 Create section finished
 Create section finished
 Create section finished
 Create section finished
 Create section finished
 Initial data, before Redistribution:
 Init section finished
 Initial data, before Redistribution:
 Init section finished
 Initial data, before Redistribution:
 Init section finished
 Initial data, before Redistribution:
 Init section finished
 Initial data, before Redistribution:
 Init section finished
 Initial data, before Redistribution:
 Init section finished
 Array contents after Transpose:
 Array contents after Transpose:
 Array contents after Transpose:
 Array contents after Transpose:
 Array contents after Transpose:
 Array contents after second Redistribution, should match original:
 Run section finished
 -----------------------------------------------------------------
 -----------------------------------------------------------------
 Array contents after Transpose:
 Array contents after second Redistribution, should match original:
 Run section finished
 -----------------------------------------------------------------
 -----------------------------------------------------------------
 Result from PET number            5
 -----------------------------------------------------------------
 -----------------------------------------------------------------
 Array contents after second Redistribution, should match original:
 Run section finished
 -----------------------------------------------------------------
 -----------------------------------------------------------------
 Result from PET number            0
 -----------------------------------------------------------------
 -----------------------------------------------------------------
 Array contents matched correctly!! PET =            0
 Finalize section finished
 Array contents after second Redistribution, should match original:
 Run section finished
 -----------------------------------------------------------------
 -----------------------------------------------------------------
 Result from PET number            1
 -----------------------------------------------------------------
 -----------------------------------------------------------------
 Array contents matched correctly!! PET =            1
 Finalize section finished
 Array contents after second Redistribution, should match original:
 Run section finished
 -----------------------------------------------------------------
 -----------------------------------------------------------------
 Result from PET number            2
 -----------------------------------------------------------------
 -----------------------------------------------------------------
 Array contents matched correctly!! PET =            2
 Finalize section finished
 Array contents after second Redistribution, should match original:
 Run section finished
 -----------------------------------------------------------------
 -----------------------------------------------------------------
 Result from PET number            3
 -----------------------------------------------------------------
 -----------------------------------------------------------------
 Array contents matched correctly!! PET =            3
 Finalize section finished
 Result from PET number            4
 -----------------------------------------------------------------
 -----------------------------------------------------------------
 Array contents matched correctly!! PET =            4
 Finalize section finished
 Array contents matched correctly!! PET =            5
 Finalize section finished
 All Destroy routines done
 System Test FieldRedistBlk2Arb complete.
 All Destroy routines done
 System Test FieldRedistBlk2Arb complete.
 All Destroy routines done
 System Test FieldRedistBlk2Arb complete.
 All Destroy routines done
 System Test FieldRedistBlk2Arb complete.
 All Destroy routines done
 System Test FieldRedistBlk2Arb complete.
 All Destroy routines done
 System Test FieldRedistBlk2Arb complete.
  PASS  System Test FieldRedistBlk2Arb: Field Redistribute, ESMF_FieldRedistBlk2
 ArbSTest.F90, line 322
  PASS  System Test FieldRedistBlk2Arb: Field Redistribute, ESMF_FieldRedistBlk2
 ArbSTest.F90, line 322
  PASS  System Test FieldRedistBlk2Arb: Field Redistribute, ESMF_FieldRedistBlk2
 ArbSTest.F90, line 322
  PASS  System Test FieldRedistBlk2Arb: Field Redistribute, ESMF_FieldRedistBlk2
 ArbSTest.F90, line 322
  PASS  System Test FieldRedistBlk2Arb: Field Redistribute, ESMF_FieldRedistBlk2
 ArbSTest.F90, line 322
  PASS  System Test FieldRedistBlk2Arb: Field Redistribute, ESMF_FieldRedistBlk2
 ArbSTest.F90, line 322
TOTCPU=17:39:44 ELAP=00:33:07 REQMEM=5875Mc REQCPUS=24 ALLOCCPUS=32 TIMELIMIT=02:30:00 PART=s4 ACCT=star
MAXRSS=0 MAXVMSIZE=196896K
________________________________________________________________
Job Resource Usage Summary for 11861249

  CPU Time Used : 17:39:44
  Memory Used : 0
  Virtual Memory Used : 196896K
  Walltime Used : 00:33:07

  Memory Requested : 5875Mc (n=per node; c=per core)
  CPUs Requested / Allocated : 24 / 32
  Walltime Requested : 02:30:00

  Execution Queue : s4
  Head Node : 
  Charged to : star

  Job Stopped : Sat Jan 22 06:57:55 UTC 2022
_____________________________________________________________________

