build time -- 2021-09-30 12:16:53
  Beginning Test, file ESMF_VMSendRecvUTest.F90, line 80
  Beginning Test, file ESMF_VMSendRecvUTest.F90, line 80
  NUMBER_OF_PROCESSORS           4
  Beginning Test, file ESMF_VMSendRecvUTest.F90, line 80
  NUMBER_OF_PROCESSORS           4
  Beginning Test, file ESMF_VMSendRecvUTest.F90, line 80
  NUMBER_OF_PROCESSORS           4
  NUMBER_OF_PROCESSORS           4
  PASS  Sending local data Test, ESMF_VMSendRecvUTest.F90, line 152
  PASS  Sending local data Test, ESMF_VMSendRecvUTest.F90, line 152
  PASS  Sending local data Test, ESMF_VMSendRecvUTest.F90, line 152
           1  After rcv i_recvData is            1           2 ( should be 
           1           2  )
  PASS  Sending local data Test, ESMF_VMSendRecvUTest.F90, line 152
  PASS  Verify local data after receive Test, ESMF_VMSendRecvUTest.F90, line 163
           2  After rcv i_recvData is          101         102 ( should be 
         101         102  )
  PASS  Verify local data after receive Test, ESMF_VMSendRecvUTest.F90, line 163
           3  After rcv i_recvData is          201         202 ( should be 
         201         202  )
  PASS  Verify local data after receive Test, ESMF_VMSendRecvUTest.F90, line 163
  PASS  Sending local data Test, ESMF_VMSendRecvUTest.F90, line 173
           0  After rcv i_recvData is          301         302 ( should be 
         301         302  )
  PASS  Verify local data after receive Test, ESMF_VMSendRecvUTest.F90, line 163
  PASS  Sending local data Test, ESMF_VMSendRecvUTest.F90, line 173
           3 After recv r4_recvData is    201.0000       202.0000     
 ( should be    201.0000       202.0000      )
           2 After recv r4_recvData is    101.0000       102.0000     
 ( should be    101.0000       102.0000      )
  PASS  Sending local data Test, ESMF_VMSendRecvUTest.F90, line 173
  PASS  Sending local data Test, ESMF_VMSendRecvUTest.F90, line 173
  PASS  Verify local data after receive Test, ESMF_VMSendRecvUTest.F90, line 185
  PASS  Verify local data after receive Test, ESMF_VMSendRecvUTest.F90, line 185
           1 After recv r4_recvData is    1.000000       2.000000     
 ( should be    1.000000       2.000000      )
  PASS  Verify local data after receive Test, ESMF_VMSendRecvUTest.F90, line 185
  PASS  Sending local data Test, ESMF_VMSendRecvUTest.F90, line 195
           0 After recv r4_recvData is    301.0000       302.0000     
 ( should be    301.0000       302.0000      )
  PASS  Verify local data after receive Test, ESMF_VMSendRecvUTest.F90, line 185
  PASS  Sending local data Test, ESMF_VMSendRecvUTest.F90, line 195
           3 After recv r8_recvData is    201.000000000000     
  PASS  Sending local data Test, ESMF_VMSendRecvUTest.F90, line 195
  PASS  Sending local data Test, ESMF_VMSendRecvUTest.F90, line 195
   202.000000000000      ( Should be    201.000000000000     
   202.000000000000       )
  PASS  Verify local data after receive Test, ESMF_VMSendRecvUTest.F90, line 207
           1 After recv r8_recvData is    1.00000000000000     
           2 After recv r8_recvData is    101.000000000000     
   102.000000000000      ( Should be    101.000000000000     
   102.000000000000       )
  PASS  Verify local data after receive Test, ESMF_VMSendRecvUTest.F90, line 207
           0 After recv r8_recvData is    301.000000000000     
   302.000000000000      ( Should be    301.000000000000     
   2.00000000000000      ( Should be    1.00000000000000     
   2.00000000000000       )
  PASS  Verify local data after receive Test, ESMF_VMSendRecvUTest.F90, line 207
   302.000000000000       )
  PASS  Verify local data after receive Test, ESMF_VMSendRecvUTest.F90, line 207
  PASS  Sending local data Test, ESMF_VMSendRecvUTest.F90, line 217
  PASS  Sending local data Test, ESMF_VMSendRecvUTest.F90, line 217
  PASS  Sending local data Test, ESMF_VMSendRecvUTest.F90, line 217
  PASS  Sending local data Test, ESMF_VMSendRecvUTest.F90, line 217
           2 After recv: Recv_Logical(1) is True
           2 After recv: Recv_Logical(2) is False
           2 After recv: Logical_soln(1) is True
           2 After recv: logical_soln(2) is False
           3 After recv: Recv_Logical(1) is False
           3 After recv: Recv_Logical(2) is True
           3 After recv: Logical_soln(1) is False
           3 After recv: logical_soln(2) is True
  PASS  Verify local data after receive Test, ESMF_VMSendRecvUTest.F90, line 238
           0 After recv: Recv_Logical(1) is True
           0 After recv: Recv_Logical(2) is False
           0 After recv: Logical_soln(1) is True
           0 After recv: logical_soln(2) is False
           1 After recv: Recv_Logical(1) is False
           1 After recv: Recv_Logical(2) is True
           1 After recv: Logical_soln(1) is False
           1 After recv: logical_soln(2) is True
  PASS  Verify local data after receive Test, ESMF_VMSendRecvUTest.F90, line 238
  PASS  Verify local data after receive Test, ESMF_VMSendRecvUTest.F90, line 238
  Ending Test, file ESMF_VMSendRecvUTest.F90, line 255
  PASS  Verify local data after receive Test, ESMF_VMSendRecvUTest.F90, line 238
  Ending Test, file ESMF_VMSendRecvUTest.F90, line 255
  Ending Test, file ESMF_VMSendRecvUTest.F90, line 255
  Ending Test, file ESMF_VMSendRecvUTest.F90, line 255
  PET           3  Test Elapsed Time    3.95099999999998       msec.
  PET           1  Test Elapsed Time    4.06100000000001       msec.
  PET           0  Test Elapsed Time    4.36799999999998       msec.
  PET           2  Test Elapsed Time    4.23199999999999       msec.
TOTCPU=05:53:36 ELAP=00:11:03 REQMEM=5875Mc REQCPUS=24 ALLOCCPUS=32 TIMELIMIT=02:30:00 PART=s4 ACCT=star
MAXRSS=0 MAXVMSIZE=196896K
________________________________________________________________
Job Resource Usage Summary for 11448110

  CPU Time Used : 05:53:36
  Memory Used : 0
  Virtual Memory Used : 196896K
  Walltime Used : 00:11:03

  Memory Requested : 5875Mc (n=per node; c=per core)
  CPUs Requested / Allocated : 24 / 32
  Walltime Requested : 02:30:00

  Execution Queue : s4
  Head Node : 
  Charged to : star

  Job Stopped : Thu Sep 30 12:27:57 UTC 2021
_____________________________________________________________________

