build time -- 2021-10-05 06:17:46
 --------------------------------------- 
 --------------------------------------- 
 --------------------------------------- 
 --------------------------------------- 
 --------------------------------------- 
 --------------------------------------- 
 Start of  System Test FieldBundleRedistArb2Arb
 --------------------------------------- 
 Start of  System Test FieldBundleRedistArb2Arb
 --------------------------------------- 
 Start of  System Test FieldBundleRedistArb2Arb
 --------------------------------------- 
 Start of  System Test FieldBundleRedistArb2Arb
 --------------------------------------- 
 Start of  System Test FieldBundleRedistArb2Arb
 --------------------------------------- 
 Start of  System Test FieldBundleRedistArb2Arb
 --------------------------------------- 
 Create section finished
 Create section finished
 Create section finished
 Create section finished
 Create section finished
 Create section finished
 Initial data, before Redistribution:
 Initial data, before Redistribution:
 Initial data, before Redistribution:
 Initial data, before Redistribution:
 Initial data, before Redistribution:
 Initial data, before Redistribution:
 Init section finished
 Init section finished
 Init section finished
 Init section finished
 Init section finished
 Init section finished
 Run ESMF_FieldBundleRedist :           0           0
 Run ESMF_FieldBundleRedist :           0           0
 Run ESMF_FieldBundleRedist :           0           0
 Run ESMF_FieldBundleRedist :           0           0
 Run ESMF_FieldBundleRedist :           0           0
 Run ESMF_FieldBundleGetField :           0           0
 Array contents after Transpose:
 Run ESMF_FieldBundleGetField :           0           0
 Array contents after Transpose:
 Run ESMF_FieldBundleGetField :           0           0
 Array contents after Transpose:
 Run ESMF_FieldBundleGetField :           0           0
 Array contents after Transpose:
 Run ESMF_FieldBundleGetField :           0           0
 Array contents after Transpose:
 Run ESMF_FieldBundleRedist :           0           0
 Run ESMF_FieldBundleGetField :           0           0
 Array contents after Transpose:
 Array contents after second Redistribution, should match original:
 Run section finished
 -----------------------------------------------------------------
 -----------------------------------------------------------------
 Result from PET number            0
 -----------------------------------------------------------------
 -----------------------------------------------------------------
 Array contents after second Redistribution, should match original:
 Run section finished
 -----------------------------------------------------------------
 -----------------------------------------------------------------
 Result from PET number            1
 -----------------------------------------------------------------
 -----------------------------------------------------------------
 Array contents after second Redistribution, should match original:
 Run section finished
 -----------------------------------------------------------------
 -----------------------------------------------------------------
 Result from PET number            4
 -----------------------------------------------------------------
 -----------------------------------------------------------------
 Array contents after second Redistribution, should match original:
 Run section finished
 -----------------------------------------------------------------
 -----------------------------------------------------------------
 Result from PET number            5
 -----------------------------------------------------------------
 -----------------------------------------------------------------
 Array contents after second Redistribution, should match original:
 Run section finished
 -----------------------------------------------------------------
 -----------------------------------------------------------------
 Result from PET number            2
 -----------------------------------------------------------------
 -----------------------------------------------------------------
 Array contents after second Redistribution, should match original:
 Run section finished
 -----------------------------------------------------------------
 -----------------------------------------------------------------
 Result from PET number            3
 -----------------------------------------------------------------
 -----------------------------------------------------------------
 Array contents matched correctly!! PET =            2
 Finalize section finished
 Array contents matched correctly!! PET =            0
 Finalize section finished
 Array contents matched correctly!! PET =            1
 Finalize section finished
 Array contents matched correctly!! PET =            4
 Finalize section finished
 Array contents matched correctly!! PET =            5
 Finalize section finished
 Array contents matched correctly!! PET =            3
 Finalize section finished
 All Destroy routines done
  System Test FieldBundleRedistArb2Arb                                          
                                                                                
                                                                                
                     complete.
 All Destroy routines done
  System Test FieldBundleRedistArb2Arb                                          
                                                                                
                                                                                
                     complete.
 ------------------------------------------------------------
 ------------------------------------------------------------
 Test finished, localPet =            1
 ------------------------------------------------------------
 ------------------------------------------------------------
 All Destroy routines done
  System Test FieldBundleRedistArb2Arb                                          
                                                                                
                                                                                
                     complete.
 ------------------------------------------------------------
 ------------------------------------------------------------
 Test finished, localPet =            2
 ------------------------------------------------------------
 ------------------------------------------------------------
 All Destroy routines done
  System Test FieldBundleRedistArb2Arb                                          
                                                                                
                                                                                
                     complete.
 ------------------------------------------------------------
 ------------------------------------------------------------
 Test finished, localPet =            3
 ------------------------------------------------------------
 ------------------------------------------------------------
 All Destroy routines done
  System Test FieldBundleRedistArb2Arb                                          
                                                                                
                                                                                
                     complete.
 ------------------------------------------------------------
 ------------------------------------------------------------
 Test finished, localPet =            4
 ------------------------------------------------------------
 ------------------------------------------------------------
  PASS  System Test FieldBundleRedistArb2Arb, ESMF_FieldBundleRedistArb2ArbSTest
 .F90, line 368
 All Destroy routines done
  System Test FieldBundleRedistArb2Arb                                          
                                                                                
                                                                                
                     complete.
 ------------------------------------------------------------
 ------------------------------------------------------------
 Test finished, localPet =            5
 ------------------------------------------------------------
 ------------------------------------------------------------
  PASS  System Test FieldBundleRedistArb2Arb, ESMF_FieldBundleRedistArb2ArbSTest
 .F90, line 368
 ------------------------------------------------------------
 ------------------------------------------------------------
 Test finished, localPet =            0
 ------------------------------------------------------------
 ------------------------------------------------------------
  PASS  System Test FieldBundleRedistArb2Arb, ESMF_FieldBundleRedistArb2ArbSTest
 .F90, line 368
 
  System Test FieldBundleRedistArb2Arb
  SUCCESS:  System Test FieldBundleRedistArb2Arb finished correctly.
 
  PASS  System Test FieldBundleRedistArb2Arb, ESMF_FieldBundleRedistArb2ArbSTest
 .F90, line 368
 
  System Test FieldBundleRedistArb2Arb
  SUCCESS:  System Test FieldBundleRedistArb2Arb finished correctly.
 
  PASS  System Test FieldBundleRedistArb2Arb, ESMF_FieldBundleRedistArb2ArbSTest
 .F90, line 368
 
  System Test FieldBundleRedistArb2Arb
  SUCCESS:  System Test FieldBundleRedistArb2Arb finished correctly.
 
  PASS  System Test FieldBundleRedistArb2Arb, ESMF_FieldBundleRedistArb2ArbSTest
 .F90, line 368
 
  System Test FieldBundleRedistArb2Arb
  SUCCESS:  System Test FieldBundleRedistArb2Arb finished correctly.
 
 
  System Test FieldBundleRedistArb2Arb
  SUCCESS:  System Test FieldBundleRedistArb2Arb finished correctly.
 
 
  System Test FieldBundleRedistArb2Arb
  SUCCESS:  System Test FieldBundleRedistArb2Arb finished correctly.
 
TOTCPU=13:10:24 ELAP=00:24:42 REQMEM=5875Mc REQCPUS=24 ALLOCCPUS=32 TIMELIMIT=02:30:00 PART=s4 ACCT=star
MAXRSS=0 MAXVMSIZE=196896K
________________________________________________________________
Job Resource Usage Summary for 11462405

  CPU Time Used : 13:10:24
  Memory Used : 0
  Virtual Memory Used : 196896K
  Walltime Used : 00:24:42

  Memory Requested : 5875Mc (n=per node; c=per core)
  CPUs Requested / Allocated : 24 / 32
  Walltime Requested : 02:30:00

  Execution Queue : s4
  Head Node : 
  Charged to : star

  Job Stopped : Tue Oct  5 06:42:29 UTC 2021
_____________________________________________________________________

