build time -- 2021-10-04 06:19:50
  Beginning Test, file ESMF_VMSendRecvUTest.F90, line 80
  NUMBER_OF_PROCESSORS           4
  Beginning Test, file ESMF_VMSendRecvUTest.F90, line 80
  NUMBER_OF_PROCESSORS           4
  Beginning Test, file ESMF_VMSendRecvUTest.F90, line 80
  NUMBER_OF_PROCESSORS           4
  Beginning Test, file ESMF_VMSendRecvUTest.F90, line 80
  NUMBER_OF_PROCESSORS           4
  PASS  Sending local data Test, ESMF_VMSendRecvUTest.F90, line 152
  PASS  Sending local data Test, ESMF_VMSendRecvUTest.F90, line 152
  PASS  Sending local data Test, ESMF_VMSendRecvUTest.F90, line 152
           0  After rcv i_recvData is          301         302 ( should be 
         301         302  )
  PASS  Verify local data after receive Test, ESMF_VMSendRecvUTest.F90, line 163
           1  After rcv i_recvData is            1           2 ( should be 
           1           2  )
  PASS  Verify local data after receive Test, ESMF_VMSendRecvUTest.F90, line 163
  PASS  Sending local data Test, ESMF_VMSendRecvUTest.F90, line 173
           2  After rcv i_recvData is          101         102 ( should be 
         101         102  )
  PASS  Verify local data after receive Test, ESMF_VMSendRecvUTest.F90, line 163
  PASS  Sending local data Test, ESMF_VMSendRecvUTest.F90, line 173
  PASS  Sending local data Test, ESMF_VMSendRecvUTest.F90, line 152
           3  After rcv i_recvData is          201         202 ( should be 
         201         202  )
           1 After recv r4_recvData is    1.000000       2.000000     
 ( should be    1.000000       2.000000      )
  PASS  Verify local data after receive Test, ESMF_VMSendRecvUTest.F90, line 185
           2 After recv r4_recvData is    101.0000       102.0000     
 ( should be    101.0000       102.0000      )
  PASS  Verify local data after receive Test, ESMF_VMSendRecvUTest.F90, line 185
  PASS  Sending local data Test, ESMF_VMSendRecvUTest.F90, line 195
  PASS  Verify local data after receive Test, ESMF_VMSendRecvUTest.F90, line 163
  PASS  Sending local data Test, ESMF_VMSendRecvUTest.F90, line 173
           2 After recv r8_recvData is    101.000000000000     
   102.000000000000      ( Should be    101.000000000000     
   102.000000000000       )
  PASS  Verify local data after receive Test, ESMF_VMSendRecvUTest.F90, line 207
  PASS  Sending local data Test, ESMF_VMSendRecvUTest.F90, line 173
           0 After recv r4_recvData is    301.0000       302.0000     
 ( should be    301.0000       302.0000      )
  PASS  Verify local data after receive Test, ESMF_VMSendRecvUTest.F90, line 185
  PASS  Sending local data Test, ESMF_VMSendRecvUTest.F90, line 195
           1 After recv r8_recvData is    1.00000000000000     
   2.00000000000000      ( Should be    1.00000000000000     
   2.00000000000000       )
  PASS  Verify local data after receive Test, ESMF_VMSendRecvUTest.F90, line 207
  PASS  Sending local data Test, ESMF_VMSendRecvUTest.F90, line 217
           2 After recv: Recv_Logical(1) is True
           3 After recv r4_recvData is    201.0000       202.0000     
 ( should be    201.0000       202.0000      )
  PASS  Verify local data after receive Test, ESMF_VMSendRecvUTest.F90, line 185
  PASS  Sending local data Test, ESMF_VMSendRecvUTest.F90, line 195
           0 After recv r8_recvData is    301.000000000000     
           2 After recv: Recv_Logical(2) is False
           2 After recv: Logical_soln(1) is True
           2 After recv: logical_soln(2) is False
  PASS  Verify local data after receive Test, ESMF_VMSendRecvUTest.F90, line 238
  Ending Test, file ESMF_VMSendRecvUTest.F90, line 255
  PASS  Sending local data Test, ESMF_VMSendRecvUTest.F90, line 195
   302.000000000000      ( Should be    301.000000000000     
   302.000000000000       )
  PASS  Verify local data after receive Test, ESMF_VMSendRecvUTest.F90, line 207
  PASS  Sending local data Test, ESMF_VMSendRecvUTest.F90, line 217
           1 After recv: Recv_Logical(1) is False
           1 After recv: Recv_Logical(2) is True
           1 After recv: Logical_soln(1) is False
           1 After recv: logical_soln(2) is True
  PASS  Verify local data after receive Test, ESMF_VMSendRecvUTest.F90, line 238
  Ending Test, file ESMF_VMSendRecvUTest.F90, line 255
           3 After recv r8_recvData is    201.000000000000     
   202.000000000000      ( Should be    201.000000000000     
   202.000000000000       )
  PASS  Verify local data after receive Test, ESMF_VMSendRecvUTest.F90, line 207
  PASS  Sending local data Test, ESMF_VMSendRecvUTest.F90, line 217
           0 After recv: Recv_Logical(1) is True
  PASS  Sending local data Test, ESMF_VMSendRecvUTest.F90, line 217
           0 After recv: Recv_Logical(2) is False
           0 After recv: Logical_soln(1) is True
           0 After recv: logical_soln(2) is False
  PASS  Verify local data after receive Test, ESMF_VMSendRecvUTest.F90, line 238
  Ending Test, file ESMF_VMSendRecvUTest.F90, line 255
           3 After recv: Recv_Logical(1) is False
           3 After recv: Recv_Logical(2) is True
           3 After recv: Logical_soln(1) is False
           3 After recv: logical_soln(2) is True
  PASS  Verify local data after receive Test, ESMF_VMSendRecvUTest.F90, line 238
  Ending Test, file ESMF_VMSendRecvUTest.F90, line 255
  PET           0  Test Elapsed Time    2.68900000000000       msec.
  PET           1  Test Elapsed Time    2.81699999999999       msec.
  PET           3  Test Elapsed Time    3.80900000000001       msec.
  PET           2  Test Elapsed Time    3.86800000000000       msec.
TOTCPU=04:43:44 ELAP=00:08:52 REQMEM=5875Mc REQCPUS=24 ALLOCCPUS=32 TIMELIMIT=02:30:00 PART=s4 ACCT=star
MAXRSS=15076K MAXVMSIZE=196896K
________________________________________________________________
Job Resource Usage Summary for 11456781

  CPU Time Used : 04:43:44
  Memory Used : 15076K
  Virtual Memory Used : 196896K
  Walltime Used : 00:08:52

  Memory Requested : 5875Mc (n=per node; c=per core)
  CPUs Requested / Allocated : 24 / 32
  Walltime Requested : 02:30:00

  Execution Queue : s4
  Head Node : 
  Charged to : star

  Job Stopped : Mon Oct  4 06:28:42 UTC 2021
_____________________________________________________________________

