build time -- 2021-10-05 06:26:50
Beginning Test, file ESMC_ArrayUTest.C, line 46
NUMBER_OF_PROCESSORS 4
Beginning Test, file ESMC_ArrayUTest.C, line 46
NUMBER_OF_PROCESSORS 4
PASS ArraySpecSet, ESMC_ArrayUTest.C, line 55
PASS ArraySpecSet, ESMC_ArrayUTest.C, line 55
PASS Set up minIndex, ESMC_ArrayUTest.C, line 65
Beginning Test, file ESMC_ArrayUTest.C, line 46
NUMBER_OF_PROCESSORS 4
PASS Set up minIndex, ESMC_ArrayUTest.C, line 65
PASS Set up maxIndex, ESMC_ArrayUTest.C, line 76
PASS Set up maxIndex, ESMC_ArrayUTest.C, line 76
PASS ArraySpecSet, ESMC_ArrayUTest.C, line 55
PASS Set up minIndex, ESMC_ArrayUTest.C, line 65
PASS Set up maxIndex, ESMC_ArrayUTest.C, line 76
PASS Create 5 x 10 ESMC_DistGrid object, ESMC_ArrayUTest.C, line 84
PASS Create 5 x 10 ESMC_DistGrid object, ESMC_ArrayUTest.C, line 84
PASS Create 5 x 10 ESMC_DistGrid object, ESMC_ArrayUTest.C, line 84
PASS Create ESMC_Array object, ESMC_ArrayUTest.C, line 96
PASS Create ESMC_Array object, ESMC_ArrayUTest.C, line 96
--- ESMCI::Array::print start ---
--- ESMCI::Array::print start ---
--- ESMCI::Array::print start ---
PASS Create ESMC_Array object, ESMC_ArrayUTest.C, line 96
 Base name    = array1
 Base name    = array1
 Status: Base = Ready,  object = Ready
 Base name    = array1
 Status: Base = Ready,  object = Ready
 Proxy        = no
 Root Info (Attributes):
 Status: Base = Ready,  object = Ready
 Proxy        = no
 Root Info (Attributes):
 Proxy        = no
 Root Info (Attributes):
{}Array typekind/rank: Integer*4 / 2 
~ lower class' values ~
DistGrid dimCount = 2
deCount = 4
localDeCount = 1
~ local data in LocalArray for DE 0 ~
LocalArrayPrint: Array at address 0x27c52c0:
            rank = 2, typekind = 3, base_addr = 0x7fe8a048bfa0
{}Array typekind/rank: Integer*4 / 2 
~ lower class' values ~
DistGrid dimCount = 2
deCount = 4
localDeCount = 1
~ local data in LocalArray for DE 1 ~
LocalArrayPrint: Array at address 0x124b7e0:
{}Array typekind/rank: Integer*4 / 2 
~ lower class' values ~
DistGrid dimCount = 2
deCount = 4
localDeCount = 1
~ local data in LocalArray for DE 2 ~
LocalArrayPrint: Array at address 0x1fe07e0:
            rank = 2, typekind = 3, base_addr = 0x7f7f9f3abd40
            dim[0] = 2  dim[1] = 10  
  Integer, *4, Dim 2, Data values:
( 1, 1) =  1397965136
( 2, 1) =  1701987104
( 1, 2) =  543519841
( 2, 2) =  544743477
( 1, 3) =  1159737393
( 2, 3) =  1598246227
( 1, 4) =  1953720644
( 2, 4) =  1684632135
( 1, 5) =  1784835872
( 2, 5) =  745825125
( 1, 6) =  1297302816
( 2, 6) =  1916886851
( 1, 7) =  1434018162
( 2, 7) =  1953719636
( 1, 8) =  539771694
            rank = 2, typekind = 3, base_addr = 0x7faa8029fd40
            dim[0] = 1  dim[1] = 10  
  Integer, *4, Dim 2, Data values:
( 1, 1) =  -2144731904
( 1, 2) =  32682
( 1, 3) =  544240928
( 1, 4) =  1232626029
( 1, 5) =  2019910766
( 1, 6) =  1397039148
( 1, 7) =  1096762189
( 1, 8) =  2036429426
( 1, 9) =  1936020565
( 1,10) =  742600308
            dim[0] = 1  dim[1] = 10  
  Integer, *4, Dim 2, Data values:
( 1, 1) =  -1623540480
( 1, 2) =  32639
( 1, 3) =  544240928
( 1, 4) =  1232626029
( 1, 5) =  2019910766
( 1, 6) =  1397039148
( 1, 7) =  1096762189
( 1, 8) =  2036429426
( 1, 9) =  1936020565
( 1,10) =  742600308
dim 1: [0]: [1 [1 [1, 1] 1] 1]
dim 2: [1]: [1 [1 [1, 10] 10] 10]
--- ESMCI::Array::print end ---
( 2, 8) =  1701734764
( 1, 9) =  825505824
( 2, 9) =  55
( 1,10) =  0
( 2,10) =  0
dim 1: [0]: [1 [1 [1, 2] 2] 2]
dim 2: [1]: [1 [1 [1, 10] 10] 10]
--- ESMCI::Array::print end ---
PASS Print ESMC_Array object, ESMC_ArrayUTest.C, line 104
dim 1: [0]: [1 [1 [1, 1] 1] 1]
dim 2: [1]: [1 [1 [1, 10] 10] 10]
--- ESMCI::Array::print end ---
PASS Print ESMC_Array object, ESMC_ArrayUTest.C, line 104
PASS Print ESMC_Array object, ESMC_ArrayUTest.C, line 104
PASS Destroy ESMC_DistGrid object, ESMC_ArrayUTest.C, line 112
PASS Destroy ESMC_DistGrid object, ESMC_ArrayUTest.C, line 112
PASS Destroy ESMC_DistGrid object, ESMC_ArrayUTest.C, line 112
PASS Destroy ESMC_Array object, ESMC_ArrayUTest.C, line 120
Ending Test, file ESMC_ArrayUTest.C, line 124
PASS Destroy ESMC_Array object, ESMC_ArrayUTest.C, line 120
Ending Test, file ESMC_ArrayUTest.C, line 124
PASS Destroy ESMC_Array object, ESMC_ArrayUTest.C, line 120
Ending Test, file ESMC_ArrayUTest.C, line 124
Beginning Test, file ESMC_ArrayUTest.C, line 46
NUMBER_OF_PROCESSORS 4
PASS ArraySpecSet, ESMC_ArrayUTest.C, line 55
PASS Set up minIndex, ESMC_ArrayUTest.C, line 65
PASS Set up maxIndex, ESMC_ArrayUTest.C, line 76
PASS Create 5 x 10 ESMC_DistGrid object, ESMC_ArrayUTest.C, line 84
PASS Create ESMC_Array object, ESMC_ArrayUTest.C, line 96
--- ESMCI::Array::print start ---
 Base name    = array1
 Status: Base = Ready,  object = Ready
 Proxy        = no
 Root Info (Attributes):
{}Array typekind/rank: Integer*4 / 2 
~ lower class' values ~
DistGrid dimCount = 2
deCount = 4
localDeCount = 1
~ local data in LocalArray for DE 3 ~
LocalArrayPrint: Array at address 0xedb7e0:
            rank = 2, typekind = 3, base_addr = 0x7f73d768fd40
            dim[0] = 1  dim[1] = 10  
  Integer, *4, Dim 2, Data values:
( 1, 1) =  -680985344
( 1, 2) =  32627
( 1, 3) =  544240928
( 1, 4) =  1232626029
( 1, 5) =  2019910766
( 1, 6) =  1397039148
( 1, 7) =  1096762189
( 1, 8) =  2036429426
( 1, 9) =  1936020565
( 1,10) =  742600308
dim 1: [0]: [1 [1 [1, 1] 1] 1]
dim 2: [1]: [1 [1 [1, 10] 10] 10]
--- ESMCI::Array::print end ---
PASS Print ESMC_Array object, ESMC_ArrayUTest.C, line 104
PASS Destroy ESMC_DistGrid object, ESMC_ArrayUTest.C, line 112
PASS Destroy ESMC_Array object, ESMC_ArrayUTest.C, line 120
Ending Test, file ESMC_ArrayUTest.C, line 124
 PET 3 Test Elapsed Time  5.344000 msec.
 PET 0 Test Elapsed Time  7.155000 msec.
 PET 1 Test Elapsed Time  7.078000 msec.
 PET 2 Test Elapsed Time  7.189000 msec.
TOTCPU=08:48:00 ELAP=00:16:30 REQMEM=5875Mc REQCPUS=24 ALLOCCPUS=32 TIMELIMIT=02:30:00 PART=s4 ACCT=star
MAXRSS=0 MAXVMSIZE=196896K
________________________________________________________________
Job Resource Usage Summary for 11462403

  CPU Time Used : 08:48:00
  Memory Used : 0
  Virtual Memory Used : 196896K
  Walltime Used : 00:16:30

  Memory Requested : 5875Mc (n=per node; c=per core)
  CPUs Requested / Allocated : 24 / 32
  Walltime Requested : 02:30:00

  Execution Queue : s4
  Head Node : 
  Charged to : star

  Job Stopped : Tue Oct  5 06:43:20 UTC 2021
_____________________________________________________________________

