build time -- 2021-10-05 06:26:50
Beginning Test, file ESMC_ClockUTest.C, line 48
NUMBER_OF_PROCESSORS 4
PASS Create ESMC_Calendar object, ESMC_ClockUTest.C, line 71
PASS Set Start Time, ESMC_ClockUTest.C, line 79
PASS Set Stop Time, ESMC_ClockUTest.C, line 87
PASS Set a TimeInterval, ESMC_ClockUTest.C, line 95
Beginning Test, file ESMC_ClockUTest.C, line 48
NUMBER_OF_PROCESSORS 4
PASS Create ESMC_Calendar object, ESMC_ClockUTest.C, line 71
PASS Create ESMC_Clock object, ESMC_ClockUTest.C, line 103
Clock ----------------------------------
Beginning Test, file ESMC_ClockUTest.C, line 48
name = TEST_CLOCK
timeStep = 
TimeInterval ---------------------------
PASS Set Start Time, ESMC_ClockUTest.C, line 79
PASS Set Stop Time, ESMC_ClockUTest.C, line 87
NUMBER_OF_PROCESSORS 4
PASS Create ESMC_Calendar object, ESMC_ClockUTest.C, line 71
P0Y0M0DT1H0M0S
end TimeInterval -----------------------

startTime = 
Time -----------------------------------
2006-01-01T00:00:00
end Time -------------------------------

stopTime = 
PASS Set a TimeInterval, ESMC_ClockUTest.C, line 95
Time -----------------------------------
2006-01-01T01:00:00
end Time -------------------------------

stopTimeEnabled = true
refTime = 
Time -----------------------------------
2006-01-01T00:00:00
end Time -------------------------------
PASS Set Start Time, ESMC_ClockUTest.C, line 79
PASS Set Stop Time, ESMC_ClockUTest.C, line 87

currTime = 
Time -----------------------------------
2006-01-01T00:00:00
end Time -------------------------------

prevTime = 
Time -----------------------------------
PASS Set a TimeInterval, ESMC_ClockUTest.C, line 95
2006-01-01T00:00:00
end Time -------------------------------

advanceCount = 0
direction = 1
userChangedDirection = false
alarmCount = 0
alarmList = 
end Clock ------------------------------

PASS Create ESMC_Clock object, ESMC_ClockUTest.C, line 103
PASS Print ESMC_Clock object, ESMC_ClockUTest.C, line 111
Beginning Test, file ESMC_ClockUTest.C, line 48
NUMBER_OF_PROCESSORS 4
Clock ----------------------------------
name = TEST_CLOCK
timeStep = 
TimeInterval ---------------------------
PASS Get ESMC_Clock object current time and advance count, ESMC_ClockUTest.C, line 119
PASS Advance the Clock object, ESMC_ClockUTest.C, line 127
PASS Create ESMC_Calendar object, ESMC_ClockUTest.C, line 71
P0Y0M0DT1H0M0S
end TimeInterval -----------------------

startTime = 
Time -----------------------------------
PASS Create ESMC_Clock object, ESMC_ClockUTest.C, line 103
PASS Get ESMC_Clock object current time and advance count, ESMC_ClockUTest.C, line 136
PASS Get currSimTime in seconds and in hours, ESMC_ClockUTest.C, line 144
PASS Verify that currSimTime in second units, ESMC_ClockUTest.C, line 151
PASS Set Start Time, ESMC_ClockUTest.C, line 79
PASS Set Stop Time, ESMC_ClockUTest.C, line 87
2006-01-01T00:00:00
end Time -------------------------------

stopTime = 
Time -----------------------------------
2006-01-01T01:00:00
end Time -------------------------------

stopTimeEnabled = true
refTime = 
Time -----------------------------------
2006-01-01T00:00:00
end Time -------------------------------

Clock ----------------------------------
name = TEST_CLOCK
timeStep = 
TimeInterval ---------------------------
P0Y0M0DT1H0M0S
end TimeInterval -----------------------

startTime = 
Time -----------------------------------
2006-01-01T00:00:00
end Time -------------------------------

PASS Verify that currSimTime in hour units, ESMC_ClockUTest.C, line 159
PASS Destroy ESMC_Clock object, ESMC_ClockUTest.C, line 168
PASS Destroy ESMC_Calendar object, ESMC_ClockUTest.C, line 176
PASS Set a TimeInterval, ESMC_ClockUTest.C, line 95
currTime = 
Time -----------------------------------
2006-01-01T00:00:00
end Time -------------------------------

prevTime = 
Time -----------------------------------
2006-01-01T00:00:00
end Time -------------------------------

advanceCount = 0
direction = 1
userChangedDirection = false
alarmCount = 0
alarmList = 
end Clock ------------------------------

stopTime = 
Time -----------------------------------
2006-01-01T01:00:00
end Time -------------------------------

stopTimeEnabled = true
refTime = 
Time -----------------------------------
2006-01-01T00:00:00
end Time -------------------------------

currTime = 
Time -----------------------------------
2006-01-01T00:00:00
Ending Test, file ESMC_ClockUTest.C, line 287
PASS Print ESMC_Clock object, ESMC_ClockUTest.C, line 111
PASS Get ESMC_Clock object current time and advance count, ESMC_ClockUTest.C, line 119
end Time -------------------------------

prevTime = 
Time -----------------------------------
2006-01-01T00:00:00
end Time -------------------------------

advanceCount = 0
direction = 1
userChangedDirection = false
alarmCount = 0
alarmList = 
end Clock ------------------------------

Clock ----------------------------------
name = TEST_CLOCK
timeStep = 
PASS Create ESMC_Clock object, ESMC_ClockUTest.C, line 103
PASS Advance the Clock object, ESMC_ClockUTest.C, line 127
PASS Get ESMC_Clock object current time and advance count, ESMC_ClockUTest.C, line 136
PASS Print ESMC_Clock object, ESMC_ClockUTest.C, line 111
PASS Get ESMC_Clock object current time and advance count, ESMC_ClockUTest.C, line 119
TimeInterval ---------------------------
P0Y0M0DT1H0M0S
end TimeInterval -----------------------

startTime = 
Time -----------------------------------
PASS Get currSimTime in seconds and in hours, ESMC_ClockUTest.C, line 144
PASS Verify that currSimTime in second units, ESMC_ClockUTest.C, line 151
PASS Verify that currSimTime in hour units, ESMC_ClockUTest.C, line 159
PASS Advance the Clock object, ESMC_ClockUTest.C, line 127
PASS Get ESMC_Clock object current time and advance count, ESMC_ClockUTest.C, line 136
2006-01-01T00:00:00
end Time -------------------------------

stopTime = 
Time -----------------------------------
2006-01-01T01:00:00
end Time -------------------------------

stopTimeEnabled = true
refTime = 
Time -----------------------------------
PASS Destroy ESMC_Clock object, ESMC_ClockUTest.C, line 168
PASS Destroy ESMC_Calendar object, ESMC_ClockUTest.C, line 176
PASS Get currSimTime in seconds and in hours, ESMC_ClockUTest.C, line 144
PASS Verify that currSimTime in second units, ESMC_ClockUTest.C, line 151
PASS Verify that currSimTime in hour units, ESMC_ClockUTest.C, line 159
2006-01-01T00:00:00
end Time -------------------------------

currTime = 
Time -----------------------------------
2006-01-01T00:00:00
end Time -------------------------------

prevTime = 
Time -----------------------------------
Ending Test, file ESMC_ClockUTest.C, line 287
PASS Destroy ESMC_Clock object, ESMC_ClockUTest.C, line 168
PASS Destroy ESMC_Calendar object, ESMC_ClockUTest.C, line 176
Ending Test, file ESMC_ClockUTest.C, line 287
2006-01-01T00:00:00
end Time -------------------------------

advanceCount = 0
direction = 1
userChangedDirection = false
alarmCount = 0
alarmList = 
end Clock ------------------------------

PASS Print ESMC_Clock object, ESMC_ClockUTest.C, line 111
PASS Get ESMC_Clock object current time and advance count, ESMC_ClockUTest.C, line 119
PASS Advance the Clock object, ESMC_ClockUTest.C, line 127
PASS Get ESMC_Clock object current time and advance count, ESMC_ClockUTest.C, line 136
PASS Get currSimTime in seconds and in hours, ESMC_ClockUTest.C, line 144
PASS Verify that currSimTime in second units, ESMC_ClockUTest.C, line 151
PASS Verify that currSimTime in hour units, ESMC_ClockUTest.C, line 159
PASS Destroy ESMC_Clock object, ESMC_ClockUTest.C, line 168
PASS Destroy ESMC_Calendar object, ESMC_ClockUTest.C, line 176
Ending Test, file ESMC_ClockUTest.C, line 287
 PET 0 Test Elapsed Time  5.379000 msec.
result = 0
 PET 3 Test Elapsed Time  4.949000 msec.
result = 0
 PET 2 Test Elapsed Time  5.156000 msec.
result = 0
 PET 1 Test Elapsed Time  4.833000 msec.
result = 0
TOTCPU=07:49:20 ELAP=00:14:40 REQMEM=5875Mc REQCPUS=24 ALLOCCPUS=32 TIMELIMIT=02:30:00 PART=s4 ACCT=star
MAXRSS=0 MAXVMSIZE=196896K
________________________________________________________________
Job Resource Usage Summary for 11462403

  CPU Time Used : 07:49:20
  Memory Used : 0
  Virtual Memory Used : 196896K
  Walltime Used : 00:14:40

  Memory Requested : 5875Mc (n=per node; c=per core)
  CPUs Requested / Allocated : 24 / 32
  Walltime Requested : 02:30:00

  Execution Queue : s4
  Head Node : 
  Charged to : star

  Job Stopped : Tue Oct  5 06:41:30 UTC 2021
_____________________________________________________________________

