build time -- 2021-12-22 06:27:54
  Beginning Test, file ESMF_AttributeUpdateMultiReconcileUTest.F90, line 802
  NUMBER_OF_PROCESSORS           6
  Beginning Test, file ESMF_AttributeUpdateMultiReconcileUTest.F90, line 802
  NUMBER_OF_PROCESSORS           6
  Beginning Test, file ESMF_AttributeUpdateMultiReconcileUTest.F90, line 802
  NUMBER_OF_PROCESSORS           6
  Beginning Test, file ESMF_AttributeUpdateMultiReconcileUTest.F90, line 802
  NUMBER_OF_PROCESSORS           6
  Beginning Test, file ESMF_AttributeUpdateMultiReconcileUTest.F90, line 802
  NUMBER_OF_PROCESSORS           6
  Beginning Test, file ESMF_AttributeUpdateMultiReconcileUTest.F90, line 802
  NUMBER_OF_PROCESSORS           6
 PET:            2 outVal: tendency_of_air_pressure
                 expected: tendency_of_air_pressure
                       rc:            0
  PASS  Getting an updated Attribute value from a Field test, ESMF_AttributeUpda
 teMultiReconcileUTest.F90, line 896
 PET:            3 outVal: tendency_of_air_pressure
                 expected: tendency_of_air_pressure
                       rc:            0
  PASS  Getting an updated Attribute value from a Field test, ESMF_AttributeUpda
 teMultiReconcileUTest.F90, line 896
 PET:            0 outVal: tendency_of_air_pressure
                 expected: tendency_of_air_pressure
                       rc:            0
  PASS  Getting an updated Attribute value from a Field test, ESMF_AttributeUpda
 teMultiReconcileUTest.F90, line 896
 PET:            1 outVal: tendency_of_air_pressure
                 expected: tendency_of_air_pressure
                       rc:            0
  PASS  Getting an updated Attribute value from a Field test, ESMF_AttributeUpda
 teMultiReconcileUTest.F90, line 896
 PET:            4 outVal: tendency_of_air_pressure
                 expected: tendency_of_air_pressure
                       rc:            0
  PASS  Getting an updated Attribute value from a Field test, ESMF_AttributeUpda
 teMultiReconcileUTest.F90, line 896
 PET:            5 outVal: tendency_of_air_pressure
                 expected: tendency_of_air_pressure
                       rc:            0
  PASS  Getting an updated Attribute value from a Field test, ESMF_AttributeUpda
 teMultiReconcileUTest.F90, line 896
 PET:            2 outVal: default_standard_name
                 expected: default_standard_name
 PET:            3 outVal: default_standard_name
                 expected: default_standard_name
  PASS  Getting an updated Attribute value from a Field test, ESMF_AttributeUpda
 teMultiReconcileUTest.F90, line 942
  PASS  Getting an updated Attribute value from a Field test, ESMF_AttributeUpda
 teMultiReconcileUTest.F90, line 942
 PET:            3 outVal: Latlon
                 expected: Latlon
 PET:            2 outVal: Latlon
                 expected: Latlon
  PASS  Getting an updated Attribute package Attribute value from a Field test, 
 ESMF_AttributeUpdateMultiReconcileUTest.F90, line 955
  PASS  Getting an updated Attribute package Attribute value from a Field test, 
 ESMF_AttributeUpdateMultiReconcileUTest.F90, line 955
 PET:            3 outVal: Yes
                 expected: Yes
  PASS  Getting an updated Attribute package Attribute value from a Field test, 
 PET:            2 outVal: Yes
                 expected: Yes
  PASS  Getting an updated Attribute package Attribute value from a Field test, 
 ESMF_AttributeUpdateMultiReconcileUTest.F90, line 965
 ESMF_AttributeUpdateMultiReconcileUTest.F90, line 965
 PET:            3 DELETED, rc =           57
  PASS  Getting an updated deleted Attribute value from a Field test, ESMF_Attri
 buteUpdateMultiReconcileUTest.F90, line 975
 PET:            2 DELETED, rc =           57
  PASS  Getting an updated deleted Attribute value from a Field test, ESMF_Attri
 buteUpdateMultiReconcileUTest.F90, line 975
  Ending Test, file ESMF_AttributeUpdateMultiReconcileUTest.F90, line 1009
  Ending Test, file ESMF_AttributeUpdateMultiReconcileUTest.F90, line 1009
 PET:            0 outVal: default_standard_name
                 expected: default_standard_name
  PASS  Getting an updated Attribute value from a Field test, ESMF_AttributeUpda
 teMultiReconcileUTest.F90, line 942
 PET:            1 outVal: default_standard_name
                 expected: default_standard_name
  PASS  Getting an updated Attribute value from a Field test, ESMF_AttributeUpda
 teMultiReconcileUTest.F90, line 942
 PET:            5 outVal: default_standard_name
                 expected: default_standard_name
 PET:            4 outVal: default_standard_name
                 expected: default_standard_name
  PASS  Getting an updated Attribute value from a Field test, ESMF_AttributeUpda
  PASS  Getting an updated Attribute value from a Field test, ESMF_AttributeUpda
 teMultiReconcileUTest.F90, line 942
 teMultiReconcileUTest.F90, line 942
 PET:            0 outVal: Latlon
                 expected: Latlon
  PASS  Getting an updated Attribute package Attribute value from a Field test, 
 ESMF_AttributeUpdateMultiReconcileUTest.F90, line 955
 PET:            1 outVal: Latlon
                 expected: Latlon
  PASS  Getting an updated Attribute package Attribute value from a Field test, 
 ESMF_AttributeUpdateMultiReconcileUTest.F90, line 955
 PET:            5 outVal: Latlon
                 expected: Latlon
 PET:            0 outVal: Yes
                 expected: Yes
 PET:            4 outVal: Latlon
                 expected: Latlon
  PASS  Getting an updated Attribute package Attribute value from a Field test, 
 ESMF_AttributeUpdateMultiReconcileUTest.F90, line 955
  PASS  Getting an updated Attribute package Attribute value from a Field test, 
 ESMF_AttributeUpdateMultiReconcileUTest.F90, line 955
  PASS  Getting an updated Attribute package Attribute value from a Field test, 
 ESMF_AttributeUpdateMultiReconcileUTest.F90, line 965
 PET:            1 outVal: Yes
                 expected: Yes
  PASS  Getting an updated Attribute package Attribute value from a Field test, 
 ESMF_AttributeUpdateMultiReconcileUTest.F90, line 965
 PET:            5 outVal: Yes
                 expected: Yes
  PASS  Getting an updated Attribute package Attribute value from a Field test, 
 PET:            4 outVal: Yes
                 expected: Yes
 ESMF_AttributeUpdateMultiReconcileUTest.F90, line 965
  PASS  Getting an updated Attribute package Attribute value from a Field test, 
 ESMF_AttributeUpdateMultiReconcileUTest.F90, line 965
 PET:            0 DELETED, rc =           57
  PASS  Getting an updated deleted Attribute value from a Field test, ESMF_Attri
 buteUpdateMultiReconcileUTest.F90, line 975
 PET:            1 DELETED, rc =           57
  PASS  Getting an updated deleted Attribute value from a Field test, ESMF_Attri
 buteUpdateMultiReconcileUTest.F90, line 975
 PET:            5 DELETED, rc =           57
  PASS  Getting an updated deleted Attribute value from a Field test, ESMF_Attri
 buteUpdateMultiReconcileUTest.F90, line 975
 PET:            4 DELETED, rc =           57
  PASS  Getting an updated deleted Attribute value from a Field test, ESMF_Attri
 buteUpdateMultiReconcileUTest.F90, line 975
  Ending Test, file ESMF_AttributeUpdateMultiReconcileUTest.F90, line 1009
  Ending Test, file ESMF_AttributeUpdateMultiReconcileUTest.F90, line 1009
  Ending Test, file ESMF_AttributeUpdateMultiReconcileUTest.F90, line 1009
  Ending Test, file ESMF_AttributeUpdateMultiReconcileUTest.F90, line 1009
  PET           5  Test Elapsed Time    20.1300000000000       msec.
  PET           2  Test Elapsed Time    20.5580000000000       msec.
  PET           3  Test Elapsed Time    20.5700000000000       msec.
  PET           4  Test Elapsed Time    20.2540000000000       msec.
  PET           0  Test Elapsed Time    20.6560000000000       msec.
  PET           1  Test Elapsed Time    21.3770000000000       msec.
TOTCPU=09:41:52 ELAP=00:18:11 REQMEM=5875Mc REQCPUS=24 ALLOCCPUS=32 TIMELIMIT=02:30:00 PART=s4 ACCT=star
MAXRSS=0 MAXVMSIZE=196896K
________________________________________________________________
Job Resource Usage Summary for 11735055

  CPU Time Used : 09:41:52
  Memory Used : 0
  Virtual Memory Used : 196896K
  Walltime Used : 00:18:11

  Memory Requested : 5875Mc (n=per node; c=per core)
  CPUs Requested / Allocated : 24 / 32
  Walltime Requested : 02:30:00

  Execution Queue : s4
  Head Node : 
  Charged to : star

  Job Stopped : Wed Dec 22 06:46:06 UTC 2021
_____________________________________________________________________

