build time -- 2021-12-04 06:28:10
  Beginning Test, file ESMF_VMSendRecvUTest.F90, line 80
  NUMBER_OF_PROCESSORS           4
  Beginning Test, file ESMF_VMSendRecvUTest.F90, line 80
  NUMBER_OF_PROCESSORS           4
  Beginning Test, file ESMF_VMSendRecvUTest.F90, line 80
  NUMBER_OF_PROCESSORS           4
  Beginning Test, file ESMF_VMSendRecvUTest.F90, line 80
  NUMBER_OF_PROCESSORS           4
  PASS  Sending local data Test, ESMF_VMSendRecvUTest.F90, line 152
           2  After rcv i_recvData is          101         102 ( should be 
         101         102  )
  PASS  Sending local data Test, ESMF_VMSendRecvUTest.F90, line 152
           1  After rcv i_recvData is            1           2 ( should be 
  PASS  Verify local data after receive Test, ESMF_VMSendRecvUTest.F90, line 163
  PASS  Sending local data Test, ESMF_VMSendRecvUTest.F90, line 152
           0  After rcv i_recvData is          301         302 ( should be 
           1           2  )
  PASS  Verify local data after receive Test, ESMF_VMSendRecvUTest.F90, line 163
  PASS  Sending local data Test, ESMF_VMSendRecvUTest.F90, line 173
           2 After recv r4_recvData is    101.0000       102.0000     
 ( should be    101.0000       102.0000      )
  PASS  Verify local data after receive Test, ESMF_VMSendRecvUTest.F90, line 185
  PASS  Sending local data Test, ESMF_VMSendRecvUTest.F90, line 152
           3  After rcv i_recvData is          201         202 ( should be 
         201         202  )
  PASS  Verify local data after receive Test, ESMF_VMSendRecvUTest.F90, line 163
  PASS  Sending local data Test, ESMF_VMSendRecvUTest.F90, line 173
         301         302  )
  PASS  Verify local data after receive Test, ESMF_VMSendRecvUTest.F90, line 163
  PASS  Sending local data Test, ESMF_VMSendRecvUTest.F90, line 173
  PASS  Sending local data Test, ESMF_VMSendRecvUTest.F90, line 173
           1 After recv r4_recvData is    1.000000       2.000000     
 ( should be    1.000000       2.000000      )
  PASS  Verify local data after receive Test, ESMF_VMSendRecvUTest.F90, line 185
           0 After recv r4_recvData is    301.0000       302.0000     
  PASS  Sending local data Test, ESMF_VMSendRecvUTest.F90, line 195
           2 After recv r8_recvData is    101.000000000000     
   102.000000000000      ( Should be    101.000000000000     
   102.000000000000       )
  PASS  Verify local data after receive Test, ESMF_VMSendRecvUTest.F90, line 207
           3 After recv r4_recvData is    201.0000       202.0000     
 ( should be    201.0000       202.0000      )
  PASS  Verify local data after receive Test, ESMF_VMSendRecvUTest.F90, line 185
  PASS  Sending local data Test, ESMF_VMSendRecvUTest.F90, line 195
 ( should be    301.0000       302.0000      )
  PASS  Verify local data after receive Test, ESMF_VMSendRecvUTest.F90, line 185
  PASS  Sending local data Test, ESMF_VMSendRecvUTest.F90, line 195
  PASS  Sending local data Test, ESMF_VMSendRecvUTest.F90, line 195
           1 After recv r8_recvData is    1.00000000000000     
   2.00000000000000      ( Should be    1.00000000000000     
   2.00000000000000       )
  PASS  Verify local data after receive Test, ESMF_VMSendRecvUTest.F90, line 207
  PASS  Sending local data Test, ESMF_VMSendRecvUTest.F90, line 217
           2 After recv: Recv_Logical(1) is True
           2 After recv: Recv_Logical(2) is False
           2 After recv: Logical_soln(1) is True
           2 After recv: logical_soln(2) is False
  PASS  Verify local data after receive Test, ESMF_VMSendRecvUTest.F90, line 238
  Ending Test, file ESMF_VMSendRecvUTest.F90, line 255
           3 After recv r8_recvData is    201.000000000000     
   202.000000000000      ( Should be    201.000000000000     
   202.000000000000       )
  PASS  Verify local data after receive Test, ESMF_VMSendRecvUTest.F90, line 207
  PASS  Sending local data Test, ESMF_VMSendRecvUTest.F90, line 217
           0 After recv r8_recvData is    301.000000000000     
   302.000000000000      ( Should be    301.000000000000     
   302.000000000000       )
  PASS  Verify local data after receive Test, ESMF_VMSendRecvUTest.F90, line 207
  PASS  Sending local data Test, ESMF_VMSendRecvUTest.F90, line 217
  PASS  Sending local data Test, ESMF_VMSendRecvUTest.F90, line 217
           1 After recv: Recv_Logical(1) is False
           1 After recv: Recv_Logical(2) is True
           1 After recv: Logical_soln(1) is False
           1 After recv: logical_soln(2) is True
  PASS  Verify local data after receive Test, ESMF_VMSendRecvUTest.F90, line 238
           3 After recv: Recv_Logical(1) is False
           3 After recv: Recv_Logical(2) is True
           3 After recv: Logical_soln(1) is False
           3 After recv: logical_soln(2) is True
  PASS  Verify local data after receive Test, ESMF_VMSendRecvUTest.F90, line 238
           0 After recv: Recv_Logical(1) is True
           0 After recv: Recv_Logical(2) is False
           0 After recv: Logical_soln(1) is True
           0 After recv: logical_soln(2) is False
  PASS  Verify local data after receive Test, ESMF_VMSendRecvUTest.F90, line 238
  Ending Test, file ESMF_VMSendRecvUTest.F90, line 255
  Ending Test, file ESMF_VMSendRecvUTest.F90, line 255
  Ending Test, file ESMF_VMSendRecvUTest.F90, line 255
  PET           0  Test Elapsed Time    2.72099999999997       msec.
  PET           2  Test Elapsed Time    2.62299999999999       msec.
  PET           3  Test Elapsed Time    3.90200000000002       msec.
  PET           1  Test Elapsed Time    3.84999999999999       msec.
TOTCPU=06:56:32 ELAP=00:13:01 REQMEM=5875Mc REQCPUS=24 ALLOCCPUS=32 TIMELIMIT=02:30:00 PART=s4 ACCT=star
MAXRSS=0 MAXVMSIZE=196896K
________________________________________________________________
Job Resource Usage Summary for 11656630

  CPU Time Used : 06:56:32
  Memory Used : 0
  Virtual Memory Used : 196896K
  Walltime Used : 00:13:01

  Memory Requested : 5875Mc (n=per node; c=per core)
  CPUs Requested / Allocated : 24 / 32
  Walltime Requested : 02:30:00

  Execution Queue : s4
  Head Node : 
  Charged to : star

  Job Stopped : Sat Dec  4 06:41:11 UTC 2021
_____________________________________________________________________

