build time -- 2022-03-03 06:22:50
 --------------------------------------- 
 --------------------------------------- 
 --------------------------------------- 
 --------------------------------------- 
 Start of  System Test FieldBundleRedistArb2Arb
 --------------------------------------- 
 --------------------------------------- 
 Start of  System Test FieldBundleRedistArb2Arb
 --------------------------------------- 
 --------------------------------------- 
 Start of  System Test FieldBundleRedistArb2Arb
 --------------------------------------- 
 Start of  System Test FieldBundleRedistArb2Arb
 --------------------------------------- 
 Start of  System Test FieldBundleRedistArb2Arb
 --------------------------------------- 
 Start of  System Test FieldBundleRedistArb2Arb
 --------------------------------------- 
 Create section finished
 Create section finished
 Create section finished
 Create section finished
 Create section finished
 Create section finished
 Initial data, before Redistribution:
 Init section finished
 Initial data, before Redistribution:
 Init section finished
 Initial data, before Redistribution:
 Init section finished
 Initial data, before Redistribution:
 Init section finished
 Initial data, before Redistribution:
 Init section finished
 Initial data, before Redistribution:
 Init section finished
 Run ESMF_FieldBundleRedist :           0           0
 Run ESMF_FieldBundleGetField :           0           0
 Array contents after Transpose:
 Run ESMF_FieldBundleRedist :           0           0
 Run ESMF_FieldBundleGetField :           0           0
 Array contents after Transpose:
 Run ESMF_FieldBundleRedist :           0           0
 Run ESMF_FieldBundleGetField :           0           0
 Array contents after Transpose:
 Array contents after second Redistribution, should match original:
 Run section finished
 -----------------------------------------------------------------
 -----------------------------------------------------------------
 Result from PET number            2
 Run ESMF_FieldBundleRedist :           0           0
 Run ESMF_FieldBundleGetField :           0           0
 Array contents after Transpose:
 Array contents after second Redistribution, should match original:
 Run section finished
 -----------------------------------------------------------------
 -----------------------------------------------------------------
 Result from PET number            3
 -----------------------------------------------------------------
 -----------------------------------------------------------------
 Run ESMF_FieldBundleRedist :           0           0
 Run ESMF_FieldBundleGetField :           0           0
 Array contents after Transpose:
 Array contents after second Redistribution, should match original:
 Run section finished
 -----------------------------------------------------------------
 -----------------------------------------------------------------
 Result from PET number            4
 -----------------------------------------------------------------
 -----------------------------------------------------------------
 Array contents matched correctly!! PET =            4
 Finalize section finished
 Run ESMF_FieldBundleRedist :           0           0
 Run ESMF_FieldBundleGetField :           0           0
 Array contents after Transpose:
 Array contents after second Redistribution, should match original:
 Run section finished
 -----------------------------------------------------------------
 -----------------------------------------------------------------
 Result from PET number            5
 -----------------------------------------------------------------
 -----------------------------------------------------------------
 Array contents matched correctly!! PET =            5
 Finalize section finished
 Array contents after second Redistribution, should match original:
 Run section finished
 -----------------------------------------------------------------
 -----------------------------------------------------------------
 Result from PET number            0
 -----------------------------------------------------------------
 -----------------------------------------------------------------
 Array contents matched correctly!! PET =            0
 Finalize section finished
 Array contents after second Redistribution, should match original:
 Run section finished
 -----------------------------------------------------------------
 -----------------------------------------------------------------
 Result from PET number            1
 -----------------------------------------------------------------
 -----------------------------------------------------------------
 Array contents matched correctly!! PET =            1
 Finalize section finished
 -----------------------------------------------------------------
 -----------------------------------------------------------------
 Array contents matched correctly!! PET =            2
 Finalize section finished
 Array contents matched correctly!! PET =            3
 Finalize section finished
 All Destroy routines done
  System Test FieldBundleRedistArb2Arb                                          
 All Destroy routines done
  System Test FieldBundleRedistArb2Arb                                          
                                                                                
                                                                                
                     complete.
 All Destroy routines done
  System Test FieldBundleRedistArb2Arb                                          
                                                                                
                                                                                
                     complete.
 ------------------------------------------------------------
 ------------------------------------------------------------
 Test finished, localPet =            1
 ------------------------------------------------------------
 ------------------------------------------------------------
 
  System Test FieldBundleRedistArb2Arb
  SUCCESS:  System Test FieldBundleRedistArb2Arb finished correctly.
 
 All Destroy routines done
  System Test FieldBundleRedistArb2Arb                                          
                                                                                
                                                                                
                     complete.
 ------------------------------------------------------------
 ------------------------------------------------------------
 Test finished, localPet =            2
 ------------------------------------------------------------
 ------------------------------------------------------------
 
  System Test FieldBundleRedistArb2Arb
  SUCCESS:  System Test FieldBundleRedistArb2Arb finished correctly.
 
 All Destroy routines done
  System Test FieldBundleRedistArb2Arb                                          
                                                                                
                                                                                
                     complete.
 ------------------------------------------------------------
 ------------------------------------------------------------
 Test finished, localPet =            3
 ------------------------------------------------------------
 ------------------------------------------------------------
  PASS  System Test FieldBundleRedistArb2Arb, ESMF_FieldBundleRedistArb2ArbSTest
 .F90, line 368
 
  System Test FieldBundleRedistArb2Arb
  SUCCESS:  System Test FieldBundleRedistArb2Arb finished correctly.
 
 All Destroy routines done
  System Test FieldBundleRedistArb2Arb                                          
                                                                                
                                                                                
                     complete.
 ------------------------------------------------------------
 ------------------------------------------------------------
 Test finished, localPet =            4
 ------------------------------------------------------------
 ------------------------------------------------------------
  PASS  System Test FieldBundleRedistArb2Arb, ESMF_FieldBundleRedistArb2ArbSTest
 .F90, line 368
                                                                                
                                                                                
                     complete.
 ------------------------------------------------------------
 ------------------------------------------------------------
 Test finished, localPet =            5
 ------------------------------------------------------------
 ------------------------------------------------------------
  PASS  System Test FieldBundleRedistArb2Arb, ESMF_FieldBundleRedistArb2ArbSTest
 .F90, line 368
 
  System Test FieldBundleRedistArb2Arb
  SUCCESS:  System Test FieldBundleRedistArb2Arb finished correctly.
 
 ------------------------------------------------------------
 ------------------------------------------------------------
 Test finished, localPet =            0
 ------------------------------------------------------------
 ------------------------------------------------------------
  PASS  System Test FieldBundleRedistArb2Arb, ESMF_FieldBundleRedistArb2ArbSTest
 .F90, line 368
 
  System Test FieldBundleRedistArb2Arb
  SUCCESS:  System Test FieldBundleRedistArb2Arb finished correctly.
 
  PASS  System Test FieldBundleRedistArb2Arb, ESMF_FieldBundleRedistArb2ArbSTest
 .F90, line 368
  PASS  System Test FieldBundleRedistArb2Arb, ESMF_FieldBundleRedistArb2ArbSTest
 .F90, line 368
 
  System Test FieldBundleRedistArb2Arb
  SUCCESS:  System Test FieldBundleRedistArb2Arb finished correctly.
 
TOTCPU=11:53:04 ELAP=00:22:17 REQMEM=5875Mc REQCPUS=24 ALLOCCPUS=32 TIMELIMIT=02:30:00 PART=s4 ACCT=star
MAXRSS=0 MAXVMSIZE=196896K
________________________________________________________________
Job Resource Usage Summary for 12223598

  CPU Time Used : 11:53:04
  Memory Used : 0
  Virtual Memory Used : 196896K
  Walltime Used : 00:22:17

  Memory Requested : 5875Mc (n=per node; c=per core)
  CPUs Requested / Allocated : 24 / 32
  Walltime Requested : 02:30:00

  Execution Queue : s4
  Head Node : 
  Charged to : star

  Job Stopped : Thu Mar  3 06:45:08 UTC 2022
_____________________________________________________________________

