build time -- 2022-01-11 06:27:29
 --------------------------------------- 
 Start of  System Test FieldBundleRedistBlk2Arb
 --------------------------------------- 
 --------------------------------------- 
 Start of  System Test FieldBundleRedistBlk2Arb
 --------------------------------------- 
 --------------------------------------- 
 Start of  System Test FieldBundleRedistBlk2Arb
 --------------------------------------- 
 --------------------------------------- 
 Start of  System Test FieldBundleRedistBlk2Arb
 --------------------------------------- 
 --------------------------------------- 
 Start of  System Test FieldBundleRedistBlk2Arb
 --------------------------------------- 
 --------------------------------------- 
 Start of  System Test FieldBundleRedistBlk2Arb
 --------------------------------------- 
 Create section finished
 Create section finished
 Create section finished
 Create section finished
 Create section finished
 Create section finished
 Initial data, before Redistribution:
 Init section finished
 Initial data, before Redistribution:
 Init section finished
 Initial data, before Redistribution:
 Init section finished
 Initial data, before Redistribution:
 Init section finished
 Initial data, before Redistribution:
 Init section finished
 Initial data, before Redistribution:
 Init section finished
 Array contents after Transpose:
 Array contents after second Redistribution, should match original:
 Run section finished
 -----------------------------------------------------------------
 -----------------------------------------------------------------
 Array contents after Transpose:
 Array contents after second Redistribution, should match original:
 Run section finished
 -----------------------------------------------------------------
 -----------------------------------------------------------------
 Result from PET number            1
 -----------------------------------------------------------------
 -----------------------------------------------------------------
 Array contents after Transpose:
 Array contents after second Redistribution, should match original:
 Run section finished
 -----------------------------------------------------------------
 -----------------------------------------------------------------
 Result from PET number            2
 -----------------------------------------------------------------
 -----------------------------------------------------------------
 Array contents after Transpose:
 Array contents after second Redistribution, should match original:
 Run section finished
 -----------------------------------------------------------------
 -----------------------------------------------------------------
 Result from PET number            3
 -----------------------------------------------------------------
 -----------------------------------------------------------------
 Array contents matched correctly!! PET =            3
 Array contents after Transpose:
 Array contents after second Redistribution, should match original:
 Run section finished
 -----------------------------------------------------------------
 -----------------------------------------------------------------
 Result from PET number            4
 -----------------------------------------------------------------
 -----------------------------------------------------------------
 Array contents matched correctly!! PET =            4
 Finalize section finished
 Array contents after Transpose:
 Array contents after second Redistribution, should match original:
 Run section finished
 -----------------------------------------------------------------
 -----------------------------------------------------------------
 Result from PET number            5
 -----------------------------------------------------------------
 -----------------------------------------------------------------
 Array contents matched correctly!! PET =            5
 Finalize section finished
 Result from PET number            0
 -----------------------------------------------------------------
 -----------------------------------------------------------------
 Array contents matched correctly!! PET =            0
 Finalize section finished
 All Destroy routines done
  System Test FieldBundleRedistBlk2Arb                                          
                                                                                
 Array contents matched correctly!! PET =            1
 Finalize section finished
 All Destroy routines done
  System Test FieldBundleRedistBlk2Arb                                          
                                                                                
                                                                                
                     complete.
 ------------------------------------------------------------
 ------------------------------------------------------------
 Test finished, localPet =            1
 ------------------------------------------------------------
 ------------------------------------------------------------
 Array contents matched correctly!! PET =            2
 Finalize section finished
 All Destroy routines done
  System Test FieldBundleRedistBlk2Arb                                          
                                                                                
                                                                                
                     complete.
 ------------------------------------------------------------
 ------------------------------------------------------------
 Test finished, localPet =            2
 ------------------------------------------------------------
 ------------------------------------------------------------
  PASS  System Test FieldBundleRedistBlk2Arb, ESMF_FieldBundleRedistBlk2ArbSTest
 .F90, line 347
 
  System Test FieldBundleRedistBlk2Arb
  SUCCESS:  System Test FieldBundleRedistBlk2Arb finished correctly.
 
 Finalize section finished
 All Destroy routines done
  System Test FieldBundleRedistBlk2Arb                                          
                                                                                
                                                                                
                     complete.
 ------------------------------------------------------------
 ------------------------------------------------------------
 Test finished, localPet =            3
 ------------------------------------------------------------
 ------------------------------------------------------------
  PASS  System Test FieldBundleRedistBlk2Arb, ESMF_FieldBundleRedistBlk2ArbSTest
 .F90, line 347
                                                                                
                     complete.
 ------------------------------------------------------------
 ------------------------------------------------------------
 Test finished, localPet =            0
 ------------------------------------------------------------
 ------------------------------------------------------------
  PASS  System Test FieldBundleRedistBlk2Arb, ESMF_FieldBundleRedistBlk2ArbSTest
 .F90, line 347
 
  System Test FieldBundleRedistBlk2Arb
  SUCCESS:  System Test FieldBundleRedistBlk2Arb finished correctly.
 
  PASS  System Test FieldBundleRedistBlk2Arb, ESMF_FieldBundleRedistBlk2ArbSTest
 .F90, line 347
 
  System Test FieldBundleRedistBlk2Arb
  SUCCESS:  System Test FieldBundleRedistBlk2Arb finished correctly.
 
 
  System Test FieldBundleRedistBlk2Arb
  SUCCESS:  System Test FieldBundleRedistBlk2Arb finished correctly.
 
 All Destroy routines done
  System Test FieldBundleRedistBlk2Arb                                          
                                                                                
                                                                                
                     complete.
 ------------------------------------------------------------
 ------------------------------------------------------------
 Test finished, localPet =            4
 ------------------------------------------------------------
 ------------------------------------------------------------
  PASS  System Test FieldBundleRedistBlk2Arb, ESMF_FieldBundleRedistBlk2ArbSTest
 .F90, line 347
 
  System Test FieldBundleRedistBlk2Arb
  SUCCESS:  System Test FieldBundleRedistBlk2Arb finished correctly.
 
 All Destroy routines done
  System Test FieldBundleRedistBlk2Arb                                          
                                                                                
                                                                                
                     complete.
 ------------------------------------------------------------
 ------------------------------------------------------------
 Test finished, localPet =            5
 ------------------------------------------------------------
 ------------------------------------------------------------
  PASS  System Test FieldBundleRedistBlk2Arb, ESMF_FieldBundleRedistBlk2ArbSTest
 .F90, line 347
 
  System Test FieldBundleRedistBlk2Arb
  SUCCESS:  System Test FieldBundleRedistBlk2Arb finished correctly.
 
TOTCPU=14:57:04 ELAP=00:28:02 REQMEM=5875Mc REQCPUS=24 ALLOCCPUS=32 TIMELIMIT=02:30:00 PART=s4 ACCT=star
MAXRSS=0 MAXVMSIZE=196896K
________________________________________________________________
Job Resource Usage Summary for 11817600

  CPU Time Used : 14:57:04
  Memory Used : 0
  Virtual Memory Used : 196896K
  Walltime Used : 00:28:02

  Memory Requested : 5875Mc (n=per node; c=per core)
  CPUs Requested / Allocated : 24 / 32
  Walltime Requested : 02:30:00

  Execution Queue : s4
  Head Node : 
  Charged to : star

  Job Stopped : Tue Jan 11 06:55:32 UTC 2022
_____________________________________________________________________

