build time -- 2022-02-18 06:27:38
  Beginning Test, file ESMF_AttributeUpdateMultiReconcileUTest.F90, line 802
  NUMBER_OF_PROCESSORS           6
  Beginning Test, file ESMF_AttributeUpdateMultiReconcileUTest.F90, line 802
  NUMBER_OF_PROCESSORS           6
  Beginning Test, file ESMF_AttributeUpdateMultiReconcileUTest.F90, line 802
  NUMBER_OF_PROCESSORS           6
  Beginning Test, file ESMF_AttributeUpdateMultiReconcileUTest.F90, line 802
  NUMBER_OF_PROCESSORS           6
  Beginning Test, file ESMF_AttributeUpdateMultiReconcileUTest.F90, line 802
  NUMBER_OF_PROCESSORS           6
  Beginning Test, file ESMF_AttributeUpdateMultiReconcileUTest.F90, line 802
  NUMBER_OF_PROCESSORS           6
 PET:            2 outVal: tendency_of_air_pressure
                 expected: tendency_of_air_pressure
                       rc:            0
  PASS  Getting an updated Attribute value from a Field test, ESMF_AttributeUpda
 teMultiReconcileUTest.F90, line 896
 PET:            3 outVal: tendency_of_air_pressure
                 expected: tendency_of_air_pressure
                       rc:            0
  PASS  Getting an updated Attribute value from a Field test, ESMF_AttributeUpda
 teMultiReconcileUTest.F90, line 896
 PET:            0 outVal: tendency_of_air_pressure
                 expected: tendency_of_air_pressure
                       rc:            0
  PASS  Getting an updated Attribute value from a Field test, ESMF_AttributeUpda
 teMultiReconcileUTest.F90, line 896
 PET:            1 outVal: tendency_of_air_pressure
                 expected: tendency_of_air_pressure
                       rc:            0
  PASS  Getting an updated Attribute value from a Field test, ESMF_AttributeUpda
 teMultiReconcileUTest.F90, line 896
 PET:            4 outVal: tendency_of_air_pressure
                 expected: tendency_of_air_pressure
                       rc:            0
  PASS  Getting an updated Attribute value from a Field test, ESMF_AttributeUpda
 teMultiReconcileUTest.F90, line 896
 PET:            5 outVal: tendency_of_air_pressure
                 expected: tendency_of_air_pressure
                       rc:            0
  PASS  Getting an updated Attribute value from a Field test, ESMF_AttributeUpda
 teMultiReconcileUTest.F90, line 896
 PET:            2 outVal: default_standard_name
                 expected: default_standard_name
  PASS  Getting an updated Attribute value from a Field test, ESMF_AttributeUpda
 teMultiReconcileUTest.F90, line 942
 PET:            3 outVal: default_standard_name
                 expected: default_standard_name
  PASS  Getting an updated Attribute value from a Field test, ESMF_AttributeUpda
 teMultiReconcileUTest.F90, line 942
 PET:            2 outVal: Latlon
                 expected: Latlon
  PASS  Getting an updated Attribute package Attribute value from a Field test, 
 ESMF_AttributeUpdateMultiReconcileUTest.F90, line 955
 PET:            2 outVal: Yes
                 expected: Yes
  PASS  Getting an updated Attribute package Attribute value from a Field test, 
 ESMF_AttributeUpdateMultiReconcileUTest.F90, line 965
 PET:            3 outVal: Latlon
                 expected: Latlon
  PASS  Getting an updated Attribute package Attribute value from a Field test, 
 ESMF_AttributeUpdateMultiReconcileUTest.F90, line 955
 PET:            3 outVal: Yes
                 expected: Yes
  PASS  Getting an updated Attribute package Attribute value from a Field test, 
 ESMF_AttributeUpdateMultiReconcileUTest.F90, line 965
 PET:            2 DELETED, rc =           57
  PASS  Getting an updated deleted Attribute value from a Field test, ESMF_Attri
 buteUpdateMultiReconcileUTest.F90, line 975
 PET:            0 outVal: default_standard_name
                 expected: default_standard_name
  PASS  Getting an updated Attribute value from a Field test, ESMF_AttributeUpda
 teMultiReconcileUTest.F90, line 942
  Ending Test, file ESMF_AttributeUpdateMultiReconcileUTest.F90, line 1009
 PET:            4 outVal: default_standard_name
                 expected: default_standard_name
  PASS  Getting an updated Attribute value from a Field test, ESMF_AttributeUpda
 teMultiReconcileUTest.F90, line 942
 PET:            0 outVal: Latlon
                 expected: Latlon
  PASS  Getting an updated Attribute package Attribute value from a Field test, 
 ESMF_AttributeUpdateMultiReconcileUTest.F90, line 955
 PET:            5 outVal: default_standard_name
                 expected: default_standard_name
  PASS  Getting an updated Attribute value from a Field test, ESMF_AttributeUpda
 teMultiReconcileUTest.F90, line 942
 PET:            0 outVal: Yes
                 expected: Yes
  PASS  Getting an updated Attribute package Attribute value from a Field test, 
 ESMF_AttributeUpdateMultiReconcileUTest.F90, line 965
 PET:            3 DELETED, rc =           57
  PASS  Getting an updated deleted Attribute value from a Field test, ESMF_Attri
 buteUpdateMultiReconcileUTest.F90, line 975
 PET:            4 outVal: Latlon
                 expected: Latlon
  PASS  Getting an updated Attribute package Attribute value from a Field test, 
 ESMF_AttributeUpdateMultiReconcileUTest.F90, line 955
 PET:            4 outVal: Yes
                 expected: Yes
  PASS  Getting an updated Attribute package Attribute value from a Field test, 
 ESMF_AttributeUpdateMultiReconcileUTest.F90, line 965
 PET:            5 outVal: Latlon
                 expected: Latlon
  PASS  Getting an updated Attribute package Attribute value from a Field test, 
 ESMF_AttributeUpdateMultiReconcileUTest.F90, line 955
  Ending Test, file ESMF_AttributeUpdateMultiReconcileUTest.F90, line 1009
 PET:            0 DELETED, rc =           57
  PASS  Getting an updated deleted Attribute value from a Field test, ESMF_Attri
 buteUpdateMultiReconcileUTest.F90, line 975
 PET:            5 outVal: Yes
                 expected: Yes
  PASS  Getting an updated Attribute package Attribute value from a Field test, 
 ESMF_AttributeUpdateMultiReconcileUTest.F90, line 965
 PET:            4 DELETED, rc =           57
  PASS  Getting an updated deleted Attribute value from a Field test, ESMF_Attri
 buteUpdateMultiReconcileUTest.F90, line 975
  Ending Test, file ESMF_AttributeUpdateMultiReconcileUTest.F90, line 1009
  Ending Test, file ESMF_AttributeUpdateMultiReconcileUTest.F90, line 1009
 PET:            1 outVal: default_standard_name
                 expected: default_standard_name
  PASS  Getting an updated Attribute value from a Field test, ESMF_AttributeUpda
 teMultiReconcileUTest.F90, line 942
 PET:            5 DELETED, rc =           57
  PASS  Getting an updated deleted Attribute value from a Field test, ESMF_Attri
 buteUpdateMultiReconcileUTest.F90, line 975
 PET:            1 outVal: Latlon
                 expected: Latlon
  PASS  Getting an updated Attribute package Attribute value from a Field test, 
 ESMF_AttributeUpdateMultiReconcileUTest.F90, line 955
 PET:            1 outVal: Yes
                 expected: Yes
  PASS  Getting an updated Attribute package Attribute value from a Field test, 
 ESMF_AttributeUpdateMultiReconcileUTest.F90, line 965
  Ending Test, file ESMF_AttributeUpdateMultiReconcileUTest.F90, line 1009
 PET:            1 DELETED, rc =           57
  PASS  Getting an updated deleted Attribute value from a Field test, ESMF_Attri
 buteUpdateMultiReconcileUTest.F90, line 975
  Ending Test, file ESMF_AttributeUpdateMultiReconcileUTest.F90, line 1009
  PET           3  Test Elapsed Time    21.7190000000000       msec.
  PET           0  Test Elapsed Time    22.6030000000000       msec.
  PET           2  Test Elapsed Time    21.0270000000000       msec.
  PET           1  Test Elapsed Time    23.3410000000000       msec.
  PET           5  Test Elapsed Time    24.5890000000000       msec.
  PET           4  Test Elapsed Time    25.1030000000000       msec.
TOTCPU=12:27:44 ELAP=00:23:22 REQMEM=5875Mc REQCPUS=24 ALLOCCPUS=32 TIMELIMIT=02:30:00 PART=s4 ACCT=star
MAXRSS=0 MAXVMSIZE=196896K
________________________________________________________________
Job Resource Usage Summary for 11997932

  CPU Time Used : 12:27:44
  Memory Used : 0
  Virtual Memory Used : 196896K
  Walltime Used : 00:23:22

  Memory Requested : 5875Mc (n=per node; c=per core)
  CPUs Requested / Allocated : 24 / 32
  Walltime Requested : 02:30:00

  Execution Queue : s4
  Head Node : 
  Charged to : star

  Job Stopped : Fri Feb 18 06:51:01 UTC 2022
_____________________________________________________________________

