build time -- 2022-02-13 06:23:15
--- ESMCI::Array::print start ---
--- ESMCI::Array::print start ---
 Base name    = Array002
--- ESMCI::Array::print start ---
 Base name    = Array002
 Status: Base = Ready,  object = Ready
 Base name    = Array002
 Status: Base = Ready,  object = Ready
 Proxy        = no
 Root Info (Attributes):
 Status: Base = Ready,  object = Ready
 Proxy        = no
 Root Info (Attributes):
 Proxy        = no
 Root Info (Attributes):
{}Array typekind/rank: Real*8 / 2 
~ lower class' values ~
DistGrid dimCount = 2
deCount = 4
{}Array typekind/rank: Real*8 / 2 
~ lower class' values ~
DistGrid dimCount = 2
deCount = 4
localDeCount = 1
~ local data in LocalArray for DE 1 ~
{}Array typekind/rank: Real*8 / 2 
~ lower class' values ~
DistGrid dimCount = 2
deCount = 4
localDeCount = 1
~ local data in LocalArray for DE 2 ~
LocalArrayPrint: Array at address 0xc96710:
            rank = 2, typekind = 6, base_addr = 0x2b6f6de52400
localDeCount = 1
~ local data in LocalArray for DE 0 ~
LocalArrayPrint: Array at address 0x1dd4150:
            rank = 2, typekind = 6, base_addr = 0x2b1324956400
LocalArrayPrint: Array at address 0x1fc4710:
            rank = 2, typekind = 6, base_addr = 0x2b40e550e400
            dim[0] = 14  dim[1] = 14  
            dim[0] = 14  dim[1] = 14  
  Real, *8, Dim 2, Data values:
--- ESMCI::Array::print start ---
            dim[0] = 14  dim[1] = 14  
  Real, *8, Dim 2, Data values:
(-1,-1) =  36.71
( 0,-1) =  36.71
( 1,-1) =  36.71
  Real, *8, Dim 2, Data values:
(-1,-1) =  36.71
( 0,-1) =  36.71
( 1,-1) =  36.71
( 2,-1) =  36.71
( 3,-1) =  36.71
( 4,-1) =  36.71
(-1,-1) =  36.71
( 0,-1) =  36.71
( 1,-1) =  36.71
( 2,-1) =  36.71
( 3,-1) =  36.71
( 4,-1) =  36.71
( 5,-1) =  36.71
( 6,-1) =  36.71
( 7,-1) =  36.71
( 2,-1) =  36.71
( 3,-1) =  36.71
( 4,-1) =  36.71
( 5,-1) =  36.71
( 6,-1) =  36.71
( 7,-1) =  36.71
( 8,-1) =  36.71
  skipping to end ...
( 3,12) =  36.71
( 4,12) =  36.71
( 5,12) =  36.71
( 6,12) =  36.71
( 7,12) =  36.71
( 5,-1) =  36.71
( 6,-1) =  36.71
( 7,-1) =  36.71
( 8,-1) =  36.71
  skipping to end ...
( 3,12) =  36.71
( 4,12) =  36.71
( 5,12) =  36.71
( 6,12) =  36.71
( 7,12) =  36.71
( 8,12) =  36.71
( 9,12) =  36.71
(10,12) =  36.71
( 8,-1) =  36.71
  skipping to end ...
( 3,12) =  36.71
( 4,12) =  36.71
( 5,12) =  36.71
( 6,12) =  36.71
( 7,12) =  36.71
( 8,12) =  36.71
( 9,12) =  36.71
(10,12) =  36.71
(11,12) =  36.71
(12,12) =  36.71
dim 1: [0]: [-1 [1 [1, 10] 10] 12]
dim 2: [1]: [-1 [1 [1, 10] 10] 12]
( 8,12) =  36.71
( 9,12) =  36.71
(10,12) =  36.71
(11,12) =  36.71
(12,12) =  36.71
dim 1: [0]: [-1 [1 [1, 10] 10] 12]
dim 2: [1]: [-1 [1 [1, 10] 10] 12]
--- ESMCI::Array::print end ---
(11,12) =  36.71
(12,12) =  36.71
dim 1: [0]: [-1 [1 [1, 10] 10] 12]
dim 2: [1]: [-1 [1 [1, 10] 10] 12]
--- ESMCI::Array::print end ---
--- ESMCI::Array::print end ---
 Base name    = Array002
 Status: Base = Ready,  object = Ready
 Proxy        = no
 Root Info (Attributes):
{}Array typekind/rank: Real*8 / 2 
~ lower class' values ~
DistGrid dimCount = 2
deCount = 4
localDeCount = 1
 localSum=   3671.00000000000     
 localSum=   3671.00000000000     
 localSum=   3671.00000000000     
~ local data in LocalArray for DE 3 ~
LocalArrayPrint: Array at address 0x2c06730:
            rank = 2, typekind = 6, base_addr = 0x2afb262ce400
            dim[0] = 14  dim[1] = 14  
  Real, *8, Dim 2, Data values:
  PASS  Example ESMF_ArrayFarrayHaloEx, ESMF_ArrayFarrayHaloEx.F90, line 177
  PASS  Example ESMF_ArrayFarrayHaloEx, ESMF_ArrayFarrayHaloEx.F90, line 177
  PASS  Example ESMF_ArrayFarrayHaloEx, ESMF_ArrayFarrayHaloEx.F90, line 177
(-1,-1) =  36.71
( 0,-1) =  36.71
( 1,-1) =  36.71
( 2,-1) =  36.71
( 3,-1) =  36.71
( 4,-1) =  36.71
( 5,-1) =  36.71
( 6,-1) =  36.71
( 7,-1) =  36.71
( 8,-1) =  36.71
  skipping to end ...
( 3,12) =  36.71
( 4,12) =  36.71
( 5,12) =  36.71
( 6,12) =  36.71
( 7,12) =  36.71
( 8,12) =  36.71
( 9,12) =  36.71
(10,12) =  36.71
(11,12) =  36.71
(12,12) =  36.71
dim 1: [0]: [-1 [1 [1, 10] 10] 12]
dim 2: [1]: [-1 [1 [1, 10] 10] 12]
--- ESMCI::Array::print end ---
 localSum=   3671.00000000000     
  PASS  Example ESMF_ArrayFarrayHaloEx, ESMF_ArrayFarrayHaloEx.F90, line 177
 PASS: ESMF_ArrayFarrayHaloEx.F90
 PASS: ESMF_ArrayFarrayHaloEx.F90
 PASS: ESMF_ArrayFarrayHaloEx.F90
 PASS: ESMF_ArrayFarrayHaloEx.F90
TOTCPU=14:56:32 ELAP=00:28:01 REQMEM=5875Mc REQCPUS=24 ALLOCCPUS=32 TIMELIMIT=02:30:00 PART=s4 ACCT=star
MAXRSS=33460K MAXVMSIZE=196896K
________________________________________________________________
Job Resource Usage Summary for 11988720

  CPU Time Used : 14:56:32
  Memory Used : 33460K
  Virtual Memory Used : 196896K
  Walltime Used : 00:28:01

  Memory Requested : 5875Mc (n=per node; c=per core)
  CPUs Requested / Allocated : 24 / 32
  Walltime Requested : 02:30:00

  Execution Queue : s4
  Head Node : 
  Charged to : star

  Job Stopped : Sun Feb 13 06:51:17 UTC 2022
_____________________________________________________________________

